"날짜","종목코드","종목명","급등 사유","등락"
"2016-06-21",32750.0,"삼진","삼성전자 IoT 신기술 '아틱' 소개에 사물인터넷 관련주 상승 속 상한가",29.86
"2016-06-21",37440.0,"희림","영남권 신공항 입지 발표를 앞두고 관련주로 부각되며 급등",13.08
"2016-06-21",104040.0,"대성파인텍","M&A 매물 소식에 급등",11.71
"2016-06-21",13000.0,"세우글로벌","영남권 신공항 입지 발표를 앞두고 급등",10.45
"2016-06-22",91970.0,"나노캠텍","최대주주 변경 및 유상증자 결정 모멘텀이 지속되며 이틀째 상한가",29.9
"2016-06-22",26910.0,"광진실업","김해공항 확장 결정에 따른 인근 부동산 소유 부각에 상한가",30.0
"2016-06-22",1570.0,"금양","中 업체와 합작투자 MOU 체결 모멘텀이 지속되며 상한가",29.98
"2016-06-22",100090.0,"삼강엠앤티","이란 업체 두 곳과 총 10억달러 규모의 MOU 체결 소식에 상한가",29.98
"2016-06-22",11390.0,"부산산업","김해공항 확장 결정에 따른 수혜 기대감에 상한가",29.96
"2016-06-22",23790.0,"동일철강","김해공항 확장 결정에 따른 인근 부동산 소유 부각에 상한가",29.89
"2016-06-22",41190.0,"우리기술투자","창투사 관련주 강세 속 상한가",29.89
"2016-06-22",7630.0,"폴루스바이오팜","최대주주 보유주식 및 경영권 양수도계약 체결 모멘텀이 지속되며 상한가",29.73
"2016-06-22",11700.0,"한신기계","M&A 가능성 제기에 급등",26.51
"2016-06-22",32080.0,"아즈텍WB","김해공항 확장 결정에 따른 인근 부동산 소유 부각에 급등",21.66
"2016-06-22",45390.0,"대아티아이","70조원 규모 국가철도망구축계획 확정 모멘텀이 지속되며 급등",20.24
"2016-06-22",52600.0,"한네트","정치권의 화폐개혁 필요성 부각에 급등",19.11
"2016-06-22",89150.0,"케이씨티","정치권의 화폐개혁 필요성 부각에 급등",16.97
"2016-06-22",66590.0,"우수AMS","테슬라 연 60만개 부품 공급 소식에 급등",16.31
"2016-06-22",12280.0,"영화금속","김해공항 확장 결정에 따른 수혜 기대감에 급등",15.71
"2016-06-22",33110.0,"코너스톤네트웍스","美 상업용 드론 운행규정 확정 소식에 드론 관련주 상승 속 급등",11.13
"2016-06-22",18500.0,"동원금속","슈퍼개미 지분 추가 매입 소식에 급등",10.34
"2016-06-23",100090.0,"삼강엠앤티","이란 업체 두 곳과 총 10억달러 규모의 MOU 체결 모멘텀이 지속되며 이틀째 상한가",30.0
"2016-06-23",144510.0,"녹십자랩셀","신규상장 첫날 상한가",30.0
"2016-06-23",11200.0,"현대상선","세계최대 해운동맹 '2M' 가입 논의 소식에 상한가",29.96
"2016-06-23",37440.0,"희림","김해공항 확장에 따른 공항설계 능력 부각에 급등",14.81
"2016-06-23","","","레고랜드 건설공사 참여 소식에 급등",""
"2016-06-23",3310.0,"대주산업","안희정 대선 출마 시사에 관련주로 부각되며 급등",12.55
"2016-06-23",83650.0,"비에이치아이","한수원과 공급계약 체결 모멘텀이 지속되며 급등",12.45
"2016-06-23",8800.0,"행남사","코마트레이드 지분 취득 결정에 급등",11.05
"2016-06-23",46310.0,"백금T&A","안희정 대선 출마 시사에 관련주로 부각되며 급등",9.01
"2016-06-24",144510.0,"녹십자랩셀","신규 상장 후 이틀째 상한가",29.94
"2016-06-24",33320.0,"제이씨현시스템","브렉시트 현실화에 비트코인 관련주 상승 속 상한가",30.0
"2016-06-24",93520.0,"매커스","브렉시트 현실화에 비트코인 관련주 상승 속 급등",23.58
"2016-06-24",46110.0,"한일네트웍스","브렉시트 현실화에 비트코인 관련주 상승 속 급등",21.74
"2016-06-24",200230.0,"텔콘RF제약","무상증자 및 최대주주 대상 유상증자 결정에 급등",21.13
"2016-06-24",900100.0,"뉴프라이드","제3자배정 유상증자에 따른 최대주주 변경 예정 소식에 급등",18.41
"2016-06-24",7630.0,"폴루스바이오팜","최대주주 보유주식 및 경영권 양수도계약 체결 모멘텀 지속에 급등",16.36
"2016-06-24",17510.0,"세명전기","김해공항 확장 수혜 기대감에 급등",10.94
"2016-06-27","","","사우디 차이나타운 개발 시행권 계약 소식에 상한가",""
"2016-06-27","","","사우디 차이나타운 개발 시행권 계약 소식에 상한가",""
"2016-06-27",37950.0,"엘컴텍","금값 급등으로 종속회사인 몽골 소재의 자원개발회사 AGM Mining LLC의 광산 가치 부각에 상한가",29.82
"2016-06-27",214390.0,"경보제약","무균 GMP 생산시설 美 FDA 승인 획득 소식에 급등",17.16
"2016-06-27",7570.0,"일양약품","백혈병 치료제 기술수출 및 완제품 독점공급 계약 체결에 급등",13.35
"2016-06-28",900100.0,"뉴프라이드","합법적 의료•기호용 대마초 사업 진출 소식에 상한가",29.96
"2016-06-28",17180.0,"명문제약","CNS(중추신경) 의약품시장 진출 기대감에 상한가",29.92
"2016-06-28",84650.0,"랩지노믹스","유전자검사 민간기업 서비스 허용 소식에 상한가",29.82
"2016-06-28",93240.0,"형지엘리트","형지그룹주 강세 속 상한가(장 마감 후 中 기업과 교복사업 합작법인 설립 공시)",29.78
"2016-06-28",11080.0,"형지I&C","형지그룹주 강세 속 급등(형지엘리트, 장 마감 후 中 기업과 교복사업 합작법인 설립 공시)",25.29
"2016-06-28",182690.0,"테라셈","中 BYD 모노레일 시장 진출 소식에 급등",21.67
"2016-06-28",127120.0,"디엔에이링크","유전자검사 민간기업 서비스 허용 소식에 급등",16.54
"2016-06-28",37070.0,"파세코","모기퇴치기 ""모스클린"" 홈쇼핑 완판 모멘텀이 지속되며 급등",16.32
"2016-06-28",112040.0,"위메이드","中 업체와 300억원 규모 “미르의전설2” 라이센스 계약 체결에 급등",13.36
"2016-06-28",93230.0,"이아이디","뉴프라이드의 합법적 의료•기호용 대마초 사업 진출 소식에 급등",12.94
"2016-06-28",3560.0,"IHQ","수익계열화를 통한 시너지 효과 기대감에 급등",12.17
"2016-06-28",46390.0,"삼화네트웍스","드라마 “함부로 애틋하게” 흥행 기대감에 급등",11.76
"2016-06-28",80530.0,"코디","전국 대형마트 500곳에 전기차 충전기 설치 소식에 전기차 관련주 상승 속 급등",11.23
"2016-06-28",45390.0,"대아티아이","70조원 규모 국가철도망구축계획 확정 모멘텀이 지속되며 급등",11.11
"2016-06-28",1060.0,"JW중외제약","JW그룹주 강세 속 급등",10.52
"2016-06-29",17180.0,"명문제약","CNS(중추신경) 의약품시장 진출 기대감 지속에 이틀째 상한가",29.95
"2016-06-29",94940.0,"푸른기술","中 BYD 모노레일 시장 진출 수혜 기대감에 상한가",29.97
"2016-06-29",208140.0,"정다운","스팩합병 상장 첫날 상한가",29.92
"2016-06-29",94190.0,"이엘케이","169억원 규모 유상증자 주금납입 완료에 급등",29.69
"2016-06-29",97520.0,"엠씨넥스","중국, 대만 업체향 지문인식 모듈 납품 소식에 급등",21.03
"2016-06-29",208710.0,"바이오로그디바이스","실적 성장 기대감에 급등",16.97
"2016-06-29",92870.0,"엑시콘","삼성전기 반도체 테스트 부품사업 YIK에 매각 소식에 급등",13.93
"2016-06-29",900100.0,"뉴프라이드","中 완다그룹과 연길 상가 10년 계약 체결 소식에 급등",12.78
"2016-06-29",60250.0,"NHN한국사이버결제","KG이니시스와 자본제휴 소식에 급등",12.53
"2016-06-29",53290.0,"NE능률","경기도 야간자율학습 폐지 소식에 교육주 상승 속 급등",11.68
"2016-06-29",131400.0,"액트","中 BYD 모노레일 시장 진출 수혜 기대감에 급등",11.28
"2016-06-29",90850.0,"이지웰페어","中 업체와 전기차 사업관련 업무협약 소식에 급등",10.14
"2016-06-30",66110.0,"한프","최대주주 변경 수반 주식양수도 계약 체결에 상한가",29.97
"2016-06-30",214270.0,"퓨쳐스트림네트웍스","일부 스팩주 급등 속 FSN과 합병 기대감이 지속되며 상한가",29.95
"2016-06-30",100090.0,"삼강엠앤티","이란과 10억달러 규모 본계약 체결 임박 소식에 상한가",29.94
"2016-06-30",204840.0,"지엘팜텍","일부 스팩주 급등 속 상한가",29.85
"2016-06-30",187790.0,"나노","정부의 미세먼지 대책에 따른 수혜 기대감에 상한가",29.83
"2016-06-30",168330.0,"내츄럴엔도텍","백수오·이엽우피소 독성시험 특이사항 없다는 소식에 급등",19.05
"2016-06-30",196170.0,"알테오젠","경쟁사 대비 기업가치 저평가 분석에 급등",15.22
"2016-06-30",38680.0,"에스넷","삼성전자, 제주도 스마트 복합관광단지 사업 제휴협약 소식에 사물인터넷/스마트홈(홈네트워크) 관련주 상승 속 급등",12.93
"2016-06-30",220260.0,"켐트로스","일부 스팩주 급등",12.32
"2016-06-30",67280.0,"멀티캠퍼스","이건희 회장 사망설에 급등",12.24
"2016-06-30",4830.0,"덕성","에어쿠션 퍼프로 고성장 기대감에 급등",10.81
"2016-07-01",123840.0,"한일진공","자회사 CIBN-K, 중국 홈쇼핑 채널 런칭 소식에 상한가",29.93
"2016-07-01",17550.0,"수산중공업","㈜수산서비스 합병 승인 소식에 상한가",29.89
"2016-07-01",66110.0,"한프","최대주주 변경 수반 주식양수도 계약 체결 모멘텀이 지속되며 이틀째 급등",23.67
"2016-07-01","","","일부 스팩주 급등",""
"2016-07-01",66410.0,"버킷스튜디오","최대주주 지분매각 추진 모멘텀이 지속되며 급등",16.21
"2016-07-01",49480.0,"오픈베이스","中 사물인터넷 시장 확대 기대감에 급등",15.26
"2016-07-01",222420.0,"쎄노텍","일부 스팩주 급등",14.75
"2016-07-01",11150.0,"CJ씨푸드","中 수산물 시장 공략 본격화 소식에 수산주 상승 속 급등",14.33
"2016-07-01",50110.0,"캠시스","삼성전자에 인수 가능성 부각에 급등",14.2
"2016-07-01",29480.0,"바른테크놀로지","삼성전자에 인수 가능성 부각에 급등",10.22
"2016-07-01",79970.0,"투비소프트","SKT 소액결제 연합 가능성 부각에 급등",9.44
"2016-07-04",15590.0,"큐로","이란공사 미수금 회수소식에 상한가",29.82
"2016-07-04",16600.0,"큐캐피탈","일부 창투사 관련주 강세 속 급등",22.15
"2016-07-04",14910.0,"성문전자","반기문 총장, 차기 대선 지지도 1위 소식에 급등",22.12
"2016-07-04",194510.0,"파티게임즈","카카오와 ""아이러브니키 for Kakao"" 공동 서비스 소식에 급등",16.1
"2016-07-04",30350.0,"드래곤플라이","리우 올림픽 VR 영상 서비스 소식에 VR 관련주 상승 속 급등",13.64
"2016-07-04",47770.0,"코데즈컴바인","거래재개 후 6거래일만에 급반등",11.7
"2016-07-04",2310.0,"아세아제지","골판지원지 수급난 우려에 골판지 제조 관련주 상승 속 급등",10.84
"2016-07-04",200230.0,"텔콘RF제약","신약개발사 ㈜비보존 지분 양수 결정에 급등",10.58
"2016-07-04",6910.0,"보성파워텍","반기문 총장, 차기 대선 지지도 1위 소식에 급등",10.26
"2016-07-04",153460.0,"네이블","SKT와 사물인터넷 전국망 구축 소식에 급등",9.43
"2016-07-05",106080.0,"하이소닉","최대주주 변경 소식에 상한가",29.98
"2016-07-05",53660.0,"현진소재","정부, 2020년까지 신재생 에너지 42조 투자 소식에 상한가",29.73
"2016-07-05",100130.0,"동국S&C","정부, 2020년까지 신재생 에너지 42조 투자 소식에 급등",23.13
"2016-07-05",44490.0,"태웅","정부, 2020년까지 신재생 에너지 42조 투자 소식에 급등",11.99
"2016-07-05",40160.0,"누리텔레콤","정부, 2020년까지 신재생 에너지 42조 투자 소식에 급등",11.33
"2016-07-05",99220.0,"SDN","정부, 2020년까지 신재생 에너지 42조 투자 소식에 급등",10.56
"2016-07-05",143540.0,"영우디에스피","장비 공급계약 체결 백지공시 모멘텀이 지속되며 급등",10.43
"2016-07-05",197210.0,"리드","中업체와 평판 디스플레이용 제조장비 공급계약 체결 모멘텀이 지속되며 급등",10.05
"2016-07-05",16600.0,"큐캐피탈","창투사 관련주 강세 속 급등",9.62
"2016-07-05",112610.0,"씨에스윈드","정부, 2020년까지 신재생 에너지 42조 투자 소식 및 157.39억원(5.3%) 규모 WIND TOWER 수주에 급등",9.38
"2016-07-06",200230.0,"텔콘RF제약","비보존, 비마약성 진통제 美 물질특허 등록 소식에 상한가",30.0
"2016-07-06",77970.0,"STX엔진","STX건설 매각 흥행 기대감에 상한가",29.95
"2016-07-06",71970.0,"STX중공업","STX건설 매각 흥행 기대감에 상한가",29.9
"2016-07-06",33340.0,"좋은사람들","중국시장 재진출 소식에 상한가",29.82
"2016-07-06",11810.0,"STX","STX건설 매각 흥행 기대감에 급등",29.75
"2016-07-06",24810.0,"이화전기","셀바이오스 주식 취득 결정에 급등",16.91
"2016-07-06",100090.0,"삼강엠앤티","정부, 2020년까지 신재생 에너지 42조 투자 모멘텀이 지속되며 급등",14.0
"2016-07-06",197210.0,"리드","中업체와 평판 디스플레이용 제조장비 공급계약 체결 모멘텀이 지속되며 급등",13.24
"2016-07-06","","","재매각 기대감에 급등",""
"2016-07-06",37950.0,"엘컴텍","브렉시트 우려 재점화에 일부 금 관련주 상승 속 급등",9.99
"2016-07-06",123840.0,"한일진공","자회사 CIBN-K, 중국 홈쇼핑 채널 런칭 모멘텀이 지속되며 급등",9.71
"2016-07-07",220260.0,"켐트로스","일부 스팩주 급등 속 상한가",30.0
"2016-07-07","","","일부 스팩주 급등",""
"2016-07-07",204840.0,"지엘팜텍","일부 스팩주 급등",19.9
"2016-07-07",71970.0,"STX중공업","STX건설 매각 흥행 기대감 지속에 급등",19.9
"2016-07-07",106520.0,"디지탈옵틱","최대주주 변경 수반 주식양수도 계약 체결에 급등",19.66
"2016-07-07",83790.0,"크리스탈","하반기 대규모 완제품 수출 계약 체결 전망에 급등",17.7
"2016-07-07",61250.0,"화일약품","크리스탈(최대주주)의 하반기 대규모 완제품 수출 계약 체결 전망에 급등",17.23
"2016-07-07",83310.0,"엘오티베큠","OLED 제조장비 공급계약 체결에 급등",16.9
"2016-07-07",71280.0,"로체시스템즈","반도체장비주 강세 속 급등",15.96
"2016-07-07",182400.0,"엔케이맥스","인도네시아 진출 모멘텀이 지속되며 급등",13.17
"2016-07-07",31980.0,"피에스케이홀딩스","반도체장비주 강세 속 급등",10.96
"2016-07-07",159910.0,"스킨앤스킨","정부의 할랄산업 신산업 육성 소식에 급등",10.18
"2016-07-08",8870.0,"금비","온양공장 유리병 생산라인 1기 생산 재개 모멘텀 지속에 이틀째 급등",25.81
"2016-07-08",65450.0,"빅텍","주한미군 사드 배치 결정에 일부 방위산업/전쟁 및 테러 관련주 급등",25.19
"2016-07-08",92220.0,"KEC","정부 전기차 산업 지원 확충 발표에 일부 전기차 관련주 급등",21.36
"2016-07-08",117670.0,"알파홀딩스","프리미어바이오의 바이오칩 사업 착수 모멘텀 지속에 이틀째 급등",19.64
"2016-07-08",138610.0,"나이벡","줄기세포 관련 美 특허권 취득에 급등",17.62
"2016-07-08",30270.0,"에스마크","자회사 디지워크, 中 의료기기/미용기기 정품인증 시장 진출 소식에 급등",16.49
"2016-07-08",1570.0,"금양","中 업체와 합작투자 MOU 체결 모멘텀 지속에 급등",15.23
"2016-07-08",92460.0,"한라IMS","밸러스트수처리장치(BWM) 협약 발효에 따른 매출 증가 기대감 지속에 급등",14.16
"2016-07-08",10280.0,"쌍용정보통신","주한미군 사드 배치 결정에 일부 방위산업/전쟁 및 테러 관련주 급등",13.58
"2016-07-08",197210.0,"리드","中업체와 평판 디스플레이용 제조장비 공급계약 체결 모멘텀 지속에 급등",13.23
"2016-07-08",13810.0,"스페코","주한미군 사드 배치 결정에 일부 방위산업/전쟁 및 테러 관련주 급등",11.11
"2016-07-08",131390.0,"피앤이솔루션","정부 전기차 산업 지원 확충 발표에 일부 전기차/2차전지 관련주 급등",10.06
"2016-07-08",225530.0,"보광산업","정부의 재정확대에 따른 수혜 전망에 급등",9.09
"2016-07-11",220260.0,"켐트로스","일부 스팩주 급등 속 상한가",29.94
"2016-07-11",200230.0,"텔콘RF제약","무상증자 권리락 효과로 상한가",29.9
"2016-07-11","","","일부 스팩주 급등",""
"2016-07-11",1470.0,"삼부토건","매각 기대감에 급등",27.69
"2016-07-11",50890.0,"쏠리드","팬택 스마트폰 판매 돌풍 소식에 급등",19.56
"2016-07-11",109820.0,"진매트릭스","유전자 증폭 방법 관련 유럽 특허권 취득에 급등",18.93
"2016-07-11",60240.0,"룽투코리아","라인 상장 수혜 기대감에 급등",13.24
"2016-07-11",60560.0,"홈센타홀딩스","朴 대통령 대구공항 통합 이전 추진 소식에 급등",11.39
"2016-07-11",64240.0,"홈캐스트","체세포복제배아연구 승인 소식에 급등",10.81
"2016-07-11",65450.0,"빅텍","주한미군 사드 배치 결정 모멘텀이 지속되며 급등",10.51
"2016-07-12",153460.0,"네이블","라인 상장 수혜 기대감이 지속되며 이틀째 상한가",29.6
"2016-07-12",25880.0,"케이씨피드","대구공항 통합 소식에 상한가",29.98
"2016-07-12",71970.0,"STX중공업","STX건설 매각 흥행 기대감 지속에 상한가",29.91
"2016-07-12",60560.0,"홈센타홀딩스","대구공항 통합 소식에 상한가",29.87
"2016-07-12",109610.0,"에스와이","주당 1주 무상증자 결정에 상한가",29.82
"2016-07-12",225530.0,"보광산업","대구공항 통합 소식에 상한가",29.66
"2016-07-12",65440.0,"이루온","중국 5G 상용화 추진 소식에 급등",24.33
"2016-07-12",222420.0,"쎄노텍","일부 스팩주 급등",23.25
"2016-07-12",200230.0,"텔콘RF제약","무상증자 권리락 효과 지속에 급등",22.65
"2016-07-12",18290.0,"브이티지엠피","유상증자 권리락 효과로 급등",15.87
"2016-07-12",11810.0,"STX","STX건설 매각 흥행 기대감 지속에 급등",14.95
"2016-07-12",16250.0,"이테크건설","실적 개선 흐름 지속 전망에 급등",14.59
"2016-07-12",77970.0,"STX엔진","STX건설 매각 흥행 기대감 지속에 급등",13.8
"2016-07-12",2020.0,"코오롱","자회사 코오롱인더 실적 개선 전망에 급등",11.48
"2016-07-12",69410.0,"엔텔스","중국 5G 상용화 추진 소식에 급등",11.11
"2016-07-12",126640.0,"화신정공","대구공항 통합 소식에 급등",10.57
"2016-07-13",109610.0,"에스와이","주당 1주 무상증자 모멘텀이 지속되며 이틀째 상한가",29.88
"2016-07-13",47080.0,"한빛소프트","포켓몬 go 흥행 소식에 상한가",29.96
"2016-07-13",32820.0,"우리기술","원전분산제어시스템 독점 납품 소식에 상한가",29.95
"2016-07-13","","","투자유치 기대감이 지속되며 상한가",""
"2016-07-13",58630.0,"엠게임","포켓몬 go 흥행 소식에 상한가",29.9
"2016-07-13",30350.0,"드래곤플라이","포켓몬 go 흥행 소식에 급등",23.01
"2016-07-13",42040.0,"케이피엠테크","유상증자 및 전환사채 발행 검토 소식에 급등",20.39
"2016-07-13",225530.0,"보광산업","대구공항 통합 모멘텀이 지속되며 급등",20.26
"2016-07-13",65440.0,"이루온","중국 5G 상용화 추진 모멘텀이 지속되며 급등",17.71
"2016-07-13",190510.0,"나무가","포켓몬 go 흥행 소식에 급등",14.64
"2016-07-13",60560.0,"홈센타홀딩스","대구공항 통합 모멘텀이 지속되며 급등",13.0
"2016-07-13",1230.0,"동국제강","2분기 영업이익 호조 모멘텀 지속 및 중국 철강 감산에 따른 수혜 기대감에 급등",12.46
"2016-07-13",29480.0,"바른테크놀로지","포켓몬 go 흥행 소식에 급등",11.03
"2016-07-13",126640.0,"화신정공","대구공항 통합 모멘텀이 지속되며 급등",10.11
"2016-07-14",123840.0,"한일진공","케이피엠테크 인수 우선협상대상자 선정 소식에 상한가",30.0
"2016-07-14",65440.0,"이루온","중국 5G 상용화 추진 모멘텀이 지속되며 상한가",29.85
"2016-07-14",72520.0,"제넨바이오","감자 및 액면분할 후 거래재개 첫날 급등",24.19
"2016-07-14",47080.0,"한빛소프트","포켓몬 go 흥행 모멘텀이 지속되며 급등",19.85
"2016-07-14",66110.0,"한프","인공지능 기반 증강현실(AR)과 가상현실(VR) 신사업 기대감에 급등",17.51
"2016-07-14",64820.0,"케이프","SGA솔루션즈 50억원 투자 유치 소식에 급등",16.59
"2016-07-14","","","투자유치 기대감이 지속되며 급등",""
"2016-07-14",12610.0,"경인양행","염료 가격 지속 상승 전망 모멘텀이 지속되며 급등",13.04
"2016-07-14",58430.0,"포스코강판","2분기 실적 호조에 급등",11.24
"2016-07-14",149940.0,"모다","美 플레이어옥션, 포켓몬go 아이템 거래 소식에 급등",11.24
"2016-07-14",78860.0,"아이오케이","포켓몬 go 흥행에 증강현실(AR) 관련주로 부각되며 급등",10.97
"2016-07-14",36930.0,"주성엔지니어링","주요 고객사들의 OLED와 3D NAND 투자에 따른 수혜 기대에 급등",10.06
"2016-07-15",101390.0,"아이엠","증강현실(AR)과 가상현실(VR) 관련 핵심기술 부각에 상한가",29.97
"2016-07-15",45340.0,"토탈소프트","포켓몬 go 흥행 모멘텀 지속으로 상한가",29.95
"2016-07-15",64260.0,"다날","미국 법인, 포켓몬 go 결제서비스 업체 지분 보유 소식에 상한가",29.92
"2016-07-15",47080.0,"한빛소프트","포켓몬 go 흥행 모멘텀 지속으로 급등",29.3
"2016-07-15",16100.0,"리더스코스메틱","中 전자상거래업체 및 홈쇼핑업체와 MOU 체결 소식에 급등",19.96
"2016-07-15",10050.0,"우리종금","우리은행 매각 기대감에 급등",13.79
"2016-07-15",66110.0,"한프","인공지능 기반 증강현실(AR)과 가상현실(VR) 신사업 기대감이 지속되며 이틀째 급등",11.76
"2016-07-15",33430.0,"디에스티","감자 및 상호변경 후 거래재개 첫날 급등",11.65
"2016-07-15",91970.0,"나노캠텍","증강현실 관련 국책과제 수행 부각에 급등",10.29
"2016-07-15",131100.0,"알이피","삼성전자의 중국 전기차 업체 BYD 투자 소식에 전기차/2차전자 관련주 상승 속 급등",10.25
"2016-07-18",101390.0,"아이엠","포켓몬 go 흥행몰이 지속에 관련주 강세 속 이틀째 상한가",29.86
"2016-07-18",106080.0,"하이소닉","日 게임업체와 가상현실(VR)·증강현실(AR) 관련 협의 소식에 상한가",29.93
"2016-07-18",80220.0,"제주반도체","中 '중관춘' M&A 모태펀드 설립 소식에 관련주로 부각되며 상한가",29.87
"2016-07-18",45340.0,"토탈소프트","포켓몬 go 흥행몰이 지속에 관련주 강세 속 급등",17.67
"2016-07-18",54450.0,"텔레칩스","포켓몬 go 흥행몰이 지속에 관련주 강세 속 급등",14.55
"2016-07-18",47560.0,"이스트소프트","포켓몬 go 흥행몰이 지속 및 '카발' IP 中 진출 소식에 급등",13.75
"2016-07-18","","","中 화이자신, 해외투자 정부 승인 소식에 급등",""
"2016-07-18",66110.0,"한프","포켓몬 go 흥행몰이 지속에 관련주 강세 속 급등",10.53
"2016-07-18",10050.0,"우리종금","우리은행 매각 기대감이 지속되며 급등",10.31
"2016-07-18",193250.0,"와이제이엠게임즈","가상현실(VR) 게임 출시하는 '일리언'에 투자 소식에 급등",10.08
"2016-07-19",222420.0,"쎄노텍","쎄노텍과 합병을 앞두고 상한가",29.99
"2016-07-19",90460.0,"비에이치","갤럭시노트 7 공개를 앞두고 관련 부품주로 부각되며 급등",21.74
"2016-07-19",106080.0,"하이소닉","햅틱 모듈 구비 휴대단말기 관련 대만 특허 취득 소식 및 日게임업체와 VR/AR 관련 협의 모멘텀 지속에 급등",17.98
"2016-07-19",88390.0,"이녹스","갤럭시노트 7 공개를 앞두고 관련 부품주로 부각되며 급등",14.55
"2016-07-19",42500.0,"링네트","日 소프트뱅크, 英 ARM 인수 소식에 사물인터넷 관련주 강세 속 급등",12.53
"2016-07-19",51370.0,"인터플렉스","갤럭시노트 7 공개를 앞두고 관련 부품주로 부각되며 급등",9.26
"2016-07-20",82800.0,"루미마이크로","서울 신축 대형건물 환경영향 평가 강화 소식에 LED주 상승 속 상한가",30.0
"2016-07-20",123010.0,"아이에이네트웍스","이전상장 첫날 상한가",29.95
"2016-07-20",36690.0,"코맥스","증강현실 적용 가능 기술 부각에 급등",23.26
"2016-07-20",39840.0,"디오","고성장세 지속 전망에 급등",18.03
"2016-07-20",66110.0,"한프","인공지능 기반 증강현실(AR)과 가상현실(VR) 신사업 기대감 지속에 급등",17.41
"2016-07-20",214310.0,"세미콘라이트","서울 신축 대형건물 환경영향 평가 강화 소식에 LED주 상승 속 급등",17.14
"2016-07-20",40350.0,"큐로컴","자회사 스마젠 에이즈백신 美 임상2상 개시 임박 소식에 급등",15.73
"2016-07-20",150840.0,"인트로메딕","바이오신약 개발 본격화 기대감에 급등",13.11
"2016-07-20",39670.0,"한류타임즈","민국저축은행 대상 35억원 규모 사모 CB발행 결정에 급등",10.53
"2016-07-20",47080.0,"한빛소프트","포켓몬 go 흥행 모멘텀 지속으로 급등",10.11
"2016-07-21",36620.0,"버추얼텍","포켓몬 go 흥행에 따른 해외 보조배터리 판매 급증 소식에 상한가",29.98
"2016-07-21","","","서태평양 망간각 독점탐사광구 확보에 따른 개발 참여 기대감에 상한가",""
"2016-07-21",47820.0,"초록뱀","드라마 'W' 흥행 기대감에 급등",24.16
