"날짜","종목코드","종목명","급등 사유","등락"
"2017-03-28",4720.0,"우리들제약","더불어민주당 호남 경선 문재인 압승 소식에 문재인 관련주로 시장에서 부각되며 급등",10.24
"2017-03-28",4770.0,"써니전자","안철수 관련주로 시장에서 부각되며 급등",9.96
"2017-03-28",241520.0,"DSC인베스트먼트","일부 창투사 관련주 급등",9.52
"2017-03-29",204840.0,"지엘팜텍","신경병성통증 치료제 연내 임상 완료 기대감에 상한가",30.0
"2017-03-29","","","자진 상장폐지 목적 공개매수 결정에 상한가",""
"2017-03-29","","","일부 스팩주 급등 속 상한가",""
"2017-03-29",25560.0,"미래산업","안철수 관련주로 시장에서 부각되며 상한가",29.84
"2017-03-29",49480.0,"오픈베이스","안철수 관련주로 시장에서 부각되며 급등",25.85
"2017-03-29",217600.0,"켐온","일부 스팩주 급등",16.25
"2017-03-29",36810.0,"에프에스티","삼성전자 사용 홍채인식칩 공급 소식에 급등",16.05
"2017-03-29",6980.0,"우성사료","문재인 관련주로 시장에서 부각되며 급등",14.29
"2017-03-29",25880.0,"케이씨피드","안철수 관련주로 시장에서 부각되며 급등",14.05
"2017-03-29",215100.0,"로보로보","일부 스팩주 급등",13.99
"2017-03-29",49950.0,"미래컴퍼니","수술로봇시스템 임상시험 종료보고서 제출 모멘텀 지속에 급등",11.94
"2017-03-29",42500.0,"링네트","안철수 관련주로 시장에서 부각되며 급등",11.83
"2017-03-29",96350.0,"대창솔루션","안철수 관련주로 시장에서 부각되며 급등",10.91
"2017-03-29",8700.0,"아남전자","삼성전자, 하만 경영 확대 기대감 지속에 급등",9.95
"2017-03-29",19770.0,"서연탑메탈","문재인 관련주로 시장에서 부각되며 급등",9.2
"2017-03-30",25880.0,"케이씨피드","안철수 관련주로 시장에서 부각되며 상한가",29.98
"2017-03-30",212560.0,"네오오토","최대주주 더불어민주당 신성장특별위원회 합류 소식에 상한가",29.97
"2017-03-30",1420.0,"태원물산","안철수 관련주로 시장에서 부각되며 상한가",29.94
"2017-03-30",94480.0,"갤럭시아컴즈","전 대표이사 더불어민주당 신성장특별위원회 합류 소식에 상한가",29.87
"2017-03-30",34940.0,"조아제약","전병서 사외이사 더불어민주당 신성장특별위원회 합류 소식에 급등",23.47
"2017-03-30","","","일부 스팩주 급등",""
"2017-03-30",8700.0,"아남전자","삼성전자, 하만 경영 확대 기대감 지속에 급등",17.42
"2017-03-30",42500.0,"링네트","안철수 관련주로 시장에서 부각되며 급등",13.17
"2017-03-30",204840.0,"지엘팜텍","신경병성통증 치료제 임상 완료 기대감에 이틀째 급등",12.5
"2017-03-30",230980.0,"솔트웍스","北 외무성 핵 선제타격 발언 소식에 급등",12.06
"2017-03-30",195440.0,"퓨전","4차 산업혁명 수혜주 부각에 급등",11.5
"2017-03-30",223310.0,"이에스브이","AR기반 G 프로젝트 공개 소식에 급등",11.19
"2017-03-30",65450.0,"빅텍","北 외무성 핵 선제타격 발언 소식에 급등",10.0
"2017-03-30",30790.0,"동양네트웍스","유안타증권과 180억원 규모 전산업무 공급계약 모멘텀 지속에 급등",9.77
"2017-03-30","","","자진 상장폐지 목적 공개매수 결정 모멘텀 지속에 급등",""
"2017-03-30",33640.0,"네패스","스마트 팩토리 사업 본격화 기대감에 지능형로봇/인공지능(AI)주 상승 속 급등",9.33
"2017-03-31",127120.0,"디엔에이링크","감사보고서 제출에 상한가",29.88
"2017-03-31","","","감사보고서 제출에 상한가",""
"2017-03-31","","","감사보고서 제출에 상한가",""
"2017-03-31",218150.0,"미래생명자원","일부 스팩주 급등",28.93
"2017-03-31",8700.0,"아남전자","갤럭시S8 기대감 부각에 급등",28.5
"2017-03-31",212560.0,"네오오토","최대주주 더불어민주당 신성장 특별위원회 합류 모멘텀 지속에 급등",27.06
"2017-03-31",60280.0,"큐렉소","스마트 팩토리 사업 본격화 기대감 지속에 급등",22.13
"2017-03-31",1840.0,"이화공영","대선 주자들을 향한 환경단체들의 4대강 보 철거 촉구에 4대강 복원주 상승 속 급등",20.18
"2017-03-31",60570.0,"드림어스컴퍼니","SK텔레콤 인공지능(AI) 기기 ‘누구’ 해외진출 부각에 급등",13.73
"2017-03-31",102940.0,"코오롱생명과학","먼디파마 등과 '인보사' 국내 마케팅 계약 모멘텀 지속에 급등",11.33
"2017-03-31",94480.0,"갤럭시아컴즈","전 대표이사 더불어민주당 신성장특별위원회 합류 모멘텀 지속에 급등",10.14
"2017-03-31",48530.0,"인트론바이오","균 증식 억제 용도 관련 특허 취득에 급등",9.77
"2017-04-03","","","상장폐지 우려 해소에 이틀째 상한가",""
"2017-04-03",3060.0,"에이프로젠제약","모회사 에이프로젠 상장 재추진 기대감에 상한가",30.0
"2017-04-03",67630.0,"에이치엘비생명과학","계열사 라이프리버㈜ 흡수합병 결정에 상한가",30.0
"2017-04-03",6920.0,"모헨즈","문재인 새만금 공약에 시장에서 관련주로 부각되며 상한가",29.88
"2017-04-03",109960.0,"에이프로젠 H&G","에이프로젠 상장 재추진 기대감에 급등",25.15
"2017-04-03",113810.0,"디젠스","문재인 새만금 공약에 시장에서 관련주로 부각되며 급등",22.2
"2017-04-03",27040.0,"서울전자통신","과거 하만 카돈과 거래 사실 부각에 급등",20.62
"2017-04-03",28300.0,"에이치엘비","에이치엘비생명과학이 라이프리버㈜ 흡수합병 결정에 급등",20.0
"2017-04-03",215100.0,"로보로보","일부 스팩주 급등",15.15
"2017-04-03",194510.0,"파티게임즈","문재인 관련주로 시장에서 부각되며 급등",11.98
"2017-04-03",58820.0,"CMG제약","란드바이오사이언스와 폐질환 치료제 공동연구 소식에 급등",9.7
"2017-04-04","","","상장폐지 우려 해소에 사흘째 상한가",""
"2017-04-04",230980.0,"솔트웍스","일부 방위산업/전쟁 및 테러 관련주 상승 속 상한가",30.0
"2017-04-04",64260.0,"다날","K뱅크 출범 순항에 인터넷은행 관련주 상승 속 급등",18.1
"2017-04-04",100030.0,"모바일리더","K뱅크 출범 순항에 인터넷은행 관련주 상승 속 급등",12.24
"2017-04-04",64480.0,"브리지텍","K뱅크 출범 순항에 인터넷은행 관련주 상승 속 급등",9.68
"2017-04-04",65450.0,"빅텍","일부 방위산업/전쟁 및 테러 관련주 상승 속 급등",9.1
"2017-04-05",131370.0,"알서포트","안철수 '4차 산업혁명' 공약에 관련주로 부각되며 상한가",29.85
"2017-04-05",4770.0,"써니전자","안철수, 국민의당 대통령 후보 선출 소식에 시장에서 관련주로 부각되며 급등",26.23
"2017-04-05",234920.0,"자이글","안철수, 국민의당 대통령 후보 선출 소식에 시장에서 관련주로 부각되며 급등",23.87
"2017-04-05",1840.0,"이화공영","일부 4대강 복원 관련주 급등",23.0
"2017-04-05",53800.0,"안랩","안철수, 국민의당 대통령 후보 선출 소식에 시장에서 관련주로 부각되며 급등",20.28
"2017-04-05",93640.0,"다믈멀티미디어","안철수, 국민의당 대통령 후보 선출 소식에 시장에서 관련주로 부각되며 급등",18.61
"2017-04-05",1420.0,"태원물산","안철수, 국민의당 대통령 후보 선출 소식에 시장에서 관련주로 부각되며 급등",15.67
"2017-04-05",83640.0,"인콘","넷마블 적정가치 13.2조 분석에 급등",15.22
"2017-04-05",93520.0,"매커스","일본, 비트코인 상용화 움직임에 비트코인 관련주 상승 속 급등",15.09
"2017-04-05",25560.0,"미래산업","안철수, 국민의당 대통령 후보 선출 소식에 시장에서 관련주로 부각되며 급등",14.93
"2017-04-05",4720.0,"우리들제약","문재인 관련주로 시장에서 부각되며 급등",13.94
"2017-04-05",18700.0,"바른손","문재인 관련주로 시장에서 부각되며 급등",13.04
"2017-04-05",42500.0,"링네트","안철수, 국민의당 대통령 후보 선출 소식에 시장에서 관련주로 부각되며 급등",11.88
"2017-04-05",19550.0,"SBI인베스트먼트","일부 창투사 관련주 급등",11.02
"2017-04-05",64480.0,"브리지텍","안철수, 국민의당 대통령 후보 선출 소식에 시장에서 관련주로 부각되며 급등",9.41
"2017-04-05",26150.0,"특수건설","일부 4대강 복원 관련주 급등",9.25
"2017-04-05",6920.0,"모헨즈","문재인 새만금 공약 모멘텀 지속에 급등",9.11
"2017-04-06",90710.0,"휴림로봇","중국 로봇시장 성장 수혜 기대감에 상한가",29.77
"2017-04-06",53160.0,"프리엠스","안철수 관련주로 시장에서 부각되며 급등",24.04
"2017-04-06",48870.0,"시너지이노베이션","중국 로봇시장 성장 수혜 기대감에 급등",22.3
"2017-04-06",102940.0,"코오롱생명과학","퇴행성 관절염 치료제 기대감에 급등",13.97
"2017-04-06",178780.0,"유테크","안철수 방문 소식 부각에 급등",13.53
"2017-04-06",234920.0,"자이글","안철수 관련주로 시장에서 부각되며 급등",13.24
"2017-04-06",27040.0,"서울전자통신","과거 하만 카돈과 거래 사실 부각 모멘텀 지속에 급등",12.93
"2017-04-06",224060.0,"코디엠","이에스브이 지분가치 부각에 급등",12.72
"2017-04-06",184230.0,"SGA솔루션즈","삼성, '블록체인' 사업 추진 수혜 부각에 급등",9.93
"2017-04-07",219130.0,"타이거일렉","PCB(FPCB 등) 관련주 상승 속 상한가",29.96
"2017-04-07",161570.0,"THE MIDONG","삼성전자 종합기술원 ""라이다"" 연구진행소식에 자율주행차 관련주 상승 속 상한가",29.93
"2017-04-07",265520.0,"AP시스템","인적분할 후 재상장 첫날 상한가",29.91
"2017-04-07","","","(주)도담시스템스 지분 취득 결정에 급등",""
"2017-04-07",1470.0,"삼부토건","재매각 본격화 기대감에 급등",20.1
"2017-04-07",223310.0,"이에스브이","애플 아이폰8 증강현실(AR)기술 탑재 가능성 유력 소식에 급등",15.99
"2017-04-07",90710.0,"휴림로봇","중국 로봇시장 성장 수혜 기대감 지속에 이틀째 급등",13.81
"2017-04-07",66700.0,"테라젠이텍스","자회사 메드팩토, 간세포암 신약 후보물질 임상2상 美 FDA 승인 소식에 급등",9.93
"2017-04-07",64480.0,"브리지텍","인터넷 전문은행 케이뱅크 흥행 소식에 인터넷은행 관련주 상승 속 급등",9.54
"2017-04-10",65450.0,"빅텍","한반도 정세불안에 방위산업/전쟁 및 테러 관련주 상승 속 상한가",29.88
"2017-04-10",94190.0,"이엘케이","갤럭시S8에 포스터치 센서 공급 소식에 상한가",29.61
"2017-04-10",13810.0,"스페코","한반도 정세불안에 방위산업/전쟁 및 테러 관련주 상승 속 급등",25.84
"2017-04-10",45520.0,"크린앤사이언스","올 봄 미세먼지 악화에 황사/미세먼지 관련주 상승 속 급등",23.79
"2017-04-10",265520.0,"AP시스템","中 OLED 투자 확대 수혜 기대감에 재상장 이틀째 급등",19.66
"2017-04-10","","","상장폐지를 위한 자사주 취득 결정 소식에 급등",""
"2017-04-10",1470.0,"삼부토건","재매각 본격화 기대감 지속에 이틀째 급등",13.12
"2017-04-10",10820.0,"퍼스텍","한반도 정세불안에 방위산업/전쟁 및 테러 관련주 상승 속 급등",12.7
"2017-04-10",25880.0,"케이씨피드","안철수 여론조사 우위 소식에 안철수 관련주로 시장에서 부각되며 급등",12.25
"2017-04-10",95190.0,"이엠코리아","한반도 정세불안 및 ITER 블랑켓 차폐블록 본제품 제작 계약 체결에 급등",10.09
"2017-04-11",214330.0,"금호에이치티","삼성전자, 마그네티 마렐리 연내 인수 소식에 상한가",29.89
"2017-04-11",5740.0,"크라운해태홀딩스","인적분할 후 변경상장 첫날 상한가",29.86
"2017-04-11",6340.0,"대원전선","대원에코그린 매각 소식에 상한가",29.82
"2017-04-11",215100.0,"로보로보","일부 스팩주 급등",19.1
"2017-04-11",17510.0,"세명전기","일부 전력설비주 급등",17.83
"2017-04-11",94190.0,"이엘케이","갤럭시S8에 포스터치 센서 공급 모멘텀 지속에 이틀째 급등",13.44
"2017-04-11",43610.0,"지니뮤직","인공지능(AI) 및 사물인터넷(IoT) 기술 활용 서비스 부각에 급등",12.76
"2017-04-11",46070.0,"코다코","삼성전자, 마그네티 마렐리 연내 인수 소식에 급등",11.02
"2017-04-11",71670.0,"에이테크솔루션","삼성전자, 마그네티 마렐리 연내 인수 소식에 급등",8.93
"2017-04-12",5740.0,"크라운해태홀딩스","인적분할 후 변경상장 이틀째 상한가",29.93
"2017-04-12",134790.0,"시디즈","최대주주 변경 소식에 상한가",29.89
"2017-04-12",43610.0,"지니뮤직","인공지능(AI) 및 사물인터넷(IoT) 기술 활용 서비스 부각 모멘텀 지속에 이틀째 급등",16.55
"2017-04-12",147830.0,"제룡산업","美-中 한반도 비핵화 협력 강화 소식에 전력설비 관련주 상승 속 급등",15.72
"2017-04-12",5420.0,"코스모화학","1분기 흑자전환에 급등",14.64
"2017-04-12",60240.0,"룽투코리아","""열혈강호 모바일"" 中 흥행 기대감에 급등",11.86
"2017-04-12",90360.0,"로보스타","매출처 다변화 기대감 부각에 급등",10.49
"2017-04-12",3030.0,"세아제강지주","美 반덤핑 세율 하향 조정 소식에 급등",10.09
"2017-04-12",36640.0,"HRS","한반도 정세불안 속 방위산업 관련주로 시장에서 부각되며 급등",9.19
"2017-04-12",42510.0,"라온시큐어","갤럭시S8 흥행 기대 속 홍채인증 기술 부각에 급등",9.03
"2017-04-13",5740.0,"크라운해태홀딩스","인적분할 후 변경상장 사흘째 상한가",29.88
"2017-04-13",32800.0,"판타지오","교육사업부문 물적분할 결정에 상한가",30.0
"2017-04-13",88800.0,"에이스테크","자율주행차량용 레이더 안테나 개발 소식에 상한가",30.0
"2017-04-13",41020.0,"인프라웨어","중동 및 아프리카 시장 진출 기대감에 상한가",29.87
"2017-04-13",45520.0,"크린앤사이언스","문재인, 미세먼지 관련 공약 발표 기대감에 황사/미세먼지 관련주 상승 속 급등",12.13
"2017-04-13",48910.0,"대원미디어","파워레인저 신작 흥행 기대감에 급등",9.52
"2017-04-14",94190.0,"이엘케이","자회사 두모전자 실적 급증 및 IPO 추진 소식에 상한가",29.81
"2017-04-14",264900.0,"크라운제과","크라운해태제과그룹주 강세 속 급등",12.15
"2017-04-14",86670.0,"비엠티","문재인, 안철수 지지율 격차 확대 소식에 시장에서 문재인 관련주로 부각되며 급등",9.16
"2017-04-14",4720.0,"우리들제약","문재인, 안철수 지지율 격차 확대 소식에 시장에서 문재인 관련주로 부각되며 급등",8.81
"2017-04-14",18700.0,"바른손","문재인, 안철수 지지율 격차 확대 소식에 시장에서 문재인 관련주로 부각되며 급등",8.07
"2017-04-17",17000.0,"신원종합개발","100억원 규모 첨단소재 공급계약 소식에 상한가",29.96
"2017-04-17","","","일부 스팩주 급등 속 상한가",""
"2017-04-17",1470.0,"삼부토건","매각 기대감에 상한가",29.87
"2017-04-17",23440.0,"제일제강","도시재생 뉴딜공약 수혜주 부각에 상한가",29.63
"2017-04-17",218150.0,"미래생명자원","일부 스팩주 급등",26.09
"2017-04-17",215100.0,"로보로보","일부 스팩주 급등",25.78
"2017-04-17",18700.0,"바른손","문재인 관련주로 시장에서 부각되며 급등",18.59
"2017-04-17",16100.0,"리더스코스메틱","美 사드 배치 우려 완화로 화장품주 상승 속 급등",17.23
"2017-04-17",41020.0,"인프라웨어","인도 주정부와 1,000만달러 규모 폴라리스 오피스 공급계약 합의 소식에 급등",16.99
"2017-04-17",53800.0,"안랩","안철수 관련주로 시장에서 부각되며 급등",16.95
"2017-04-17","","","KB금융으로 완전자회사 편입 소식에 급등",""
"2017-04-17",4720.0,"우리들제약","문재인 관련주로 시장에서 부각되며 급등",12.57
"2017-04-17",4770.0,"써니전자","안철수 관련주로 시장에서 부각되며 급등",10.67
"2017-04-17",38950.0,"파인디지털","애플 자율주행차 공식화에 따른 수혜 부각에 급등",10.59
"2017-04-17",118000.0,"우리들휴브레인","문재인 관련주로 시장에서 부각되며 급등",9.34
"2017-04-18",1470.0,"삼부토건","매각 기대감에 이틀째 상한가",30.0
"2017-04-18",1260.0,"남광토건","삼부토건 매각 기대감에 상한가",30.0
"2017-04-18",8700.0,"아남전자","IoT스피커 개발 기대감에 상한가",29.9
"2017-04-18",192080.0,"더블유게임즈","美 소셜카지노업체 인수 결정에 상한가",29.89
"2017-04-18",17000.0,"신원종합개발","삼부토건 매각 기대감에 이틀째 급등",17.48
"2017-04-18",91590.0,"남화토건","삼부토건 매각 기대감에 급등",16.78
"2017-04-18",201490.0,"미투온","더블유게임즈의 美 소셜카지노업체 인수 결정에 급등",16.46
"2017-04-18",213420.0,"덕산네오룩스","1분기 호실적에 급등",15.51
"2017-04-18",60240.0,"룽투코리아","열혈강호 모바일 中 안드로이드 마켓 최고 매출 2위 소식에 급등",10.27
"2017-04-18",1840.0,"이화공영","삼부토건 매각 기대감에 급등",9.69
"2017-04-18","","","일부 스팩주 급등",""
"2017-04-19",203650.0,"드림시큐리티","암호기술연구센터 개소 예정 소식에 상한가",30.0
"2017-04-19",56360.0,"코위버","SKT와 양자암호장비 개발 부각에 상한가",29.93
"2017-04-19",109610.0,"에스와이","계열사 흡수합병 결정에 급등",18.99
"2017-04-19",46970.0,"우리로","양자암호통신 핵심 기술 부각에 급등",15.4
"2017-04-19",10170.0,"대한광통신","5G(세대) 상용화에 따른 수요 증가 기대감 부각에 급등",13.87
"2017-04-19",1470.0,"삼부토건","매각 기대감 지속에 사흘째 급등",11.54
"2017-04-19",6880.0,"신송홀딩스","하림그룹, 신송식품 인수 추진 소식에 급등",10.07
"2017-04-19",145720.0,"덴티움","문재인 대선후보 임플란트 관련 정책 발표에 치아치료(임플란트 등)관련주 상승 속 급등",10.07
"2017-04-19",63080.0,"게임빌","신작 '워오브크라운' 흥행 기대감에 급등",9.03
"2017-04-20","","","도담시스템스가 사우디 KBW인베스트먼트와 합작법인 설립계약 체결 소식에 상한가",""
"2017-04-20",124500.0,"아이티센","공군 통합전산운영 사업 수주 소식에 상한가",29.96
"2017-04-20",17510.0,"세명전기","김해신공항 입찰공고 소식에 급등",28.62
"2017-04-20",89980.0,"상아프론테크","고어텍스 멤브레인 개발에 따른 성장 기대감에 급등",18.18
"2017-04-20",30270.0,"에스마크","중국 홈쇼핑 진출 기대감 등으로 이틀째 급등",13.74
"2017-04-20",26910.0,"광진실업","김해신공항 입찰공고 소식에 급등",11.46
"2017-04-21",23350.0,"한국종합기술","최대주주 지분매각 검토 소식에 상한가",29.92
"2017-04-21",4100.0,"태양금속","주요주주 지분 확대 소식에 급등",18.46
"2017-04-21",203650.0,"드림시큐리티","암호기술연구센터 개소 예정 모멘텀 지속에 급등",17.13
"2017-04-21",139670.0,"키네마스터","구글 와이드바인이 탑재된 HLS 플레이어 출시 소식에 급등",13.65
"2017-04-21",94190.0,"이엘케이","삼성전자 갤럭시S8 '포스터치' 확대 적용 기대감 부각에 급등",12.37
"2017-04-21",50860.0,"아세아텍","대규모 자사주 취득 결정에 급등",10.57
"2017-04-21",194510.0,"파티게임즈","모바일 소셜 카지노 시장 성장 기대감 지속에 급등",9.42
"2017-04-21",41020.0,"인프라웨어","인도 주정부에 폴라리스 오피스 공급 합의 소식에 급등",9.11
"2017-04-24",63440.0,"SM Life Design","나눔로또 계약 소식에 상한가",29.93
"2017-04-24",14940.0,"오리엔탈정공","매각 본계약 체결 기대감에 급등",21.95
"2017-04-24",3160.0,"디아이","싸이 컴백 소식에 급등",16.14
"2017-04-24",173940.0,"에프엔씨엔터","에프엔씨애드컬쳐 나눔로또 계약 소식에 급등",15.13
"2017-04-24",33100.0,"제룡전기","中 왕이 외교부장, 한반도 문제 관련 평화적 해결 강조 발언에 전력설비주 상승 속 급등",10.47
"2017-04-25",189860.0,"서전기전","북한 무력도발 가능성 약화에 전력설비주 상승 속 상한가",29.94
"2017-04-25",54180.0,"중앙오션","대북 철도사업 수혜 기대감 부각에 상한가",29.84
"2017-04-25","","","일부 스팩주 급등",""
"2017-04-25",6910.0,"보성파워텍","북한 무력도발 가능성 약화에 전력설비주 상승 속 급등",15.25
"2017-04-25",30270.0,"에스마크","中 영유아 시장 진출에 따른 기대감 부각에 급등",12.32
"2017-04-25",195990.0,"에이비프로바이오","경영권 분쟁 조짐에 급등",11.45
"2017-04-25",56000.0,"신스타임즈","1분기 호실적에 급등",9.41
"2017-04-26",197210.0,"리드","액면분할 후 거래재개 첫날 상한가",29.95
"2017-04-26",90370.0,"메타랩스","경영정상화 기대감에 상한가",29.88
"2017-04-26","","","최대주주 변경에 급등",""
"2017-04-26",2630.0,"오리엔트바이오","발모신약 개발 기대감 부각에 급등",19.83
"2017-04-26",215380.0,"우정바이오","우정비에스씨 합병상장을 앞두고 급등",17.47
"2017-04-26","","","사드 기습 배치에 따른 반사이익 기대감에 국내 상장 중국기업 상승 속 급등",""
"2017-04-26",59120.0,"아진엑스텍","中 로봇굴기 수혜 기대감 지속에 급등",14.16
"2017-04-26",206560.0,"덱스터","아세안 디지털콘텐츠 수출 확대 기대감 부각에 급등",11.59
"2017-04-26",65500.0,"오리엔트정공","오리엔트바이오 발모신약 개발 기대감 부각에 급등",11.57
"2017-04-26",60570.0,"드림어스컴퍼니","4차산업 혁명 관련 융합얼라이언스 출범 소식에 따른 수혜 기대감에 급등",11.0
"2017-04-26",2320.0,"한진","턴어라운드 기대감에 급등",10.11
"2017-04-27",60260.0,"뉴보텍","한거희 회장 문재인 캠프 합류 소식에 상한가",29.83
"2017-04-27",5740.0,"크라운해태홀딩스","공정위로부터 지주사 기준요건 충족 통보에 급등",22.45
"2017-04-27",69730.0,"DSR제강","시장에서 문재인 관련주로 부각되며 급등",20.07
"2017-04-27",14940.0,"오리엔탈정공","매각 본계약 체결 기대감 지속에 급등",17.75
"2017-04-27",54180.0,"중앙오션","대북 철도사업 수혜 기대감 지속에 급등",16.98
"2017-04-27",215480.0,"토박스코리아","토박스코리아 합병 신주상장을 앞두고 급등",12.57
"2017-04-27",155660.0,"DSR","시장에서 문재인 관련주로 부각되며 급등",11.75
"2017-04-27",14990.0,"인디에프","개성공단 재개 기대감에 남북경협주 상승 속 급등",10.9
"2017-04-27",5300.0,"롯데칠성","롯데그룹 지주사 전환 소식에 급등",10.87
"2017-04-27",197210.0,"리드","주당 0.5주 무상증자 결정 및 액면분할 효과 지속에 급등",10.41
"2017-04-27",52190.0,"이에스에이","엘피파트너스 대상 3자배정 유증 모멘텀 지속에 급등",10.15
"2017-04-28",5860.0,"한일사료","트럼프 한미FTA 재협상 발언에 상한가",29.9
"2017-04-28",23350.0,"한국종합기술","최대주주 지분매각 검토 기대감 지속에 급등",15.63
"2017-04-28",8290.0,"원풍물산","美 투자 바이오사, 신약 FDA 패스트트랙 지정 소식에 급등",11.12
"2017-05-02",64090.0,"에프앤리퍼블릭","투자주의환기종목 해제 소식에 상한가",30.0
"2017-05-02",33100.0,"제룡전기","트럼프, 김정은 대면 관련 발언에 전력설비 관련주 상승 속 급등",13.88
"2017-05-02",77970.0,"STX엔진","알파라발과 선박평형수처리시스템 관련 업무협약 체결 모멘텀 지속에 급등",13.35
"2017-05-02","","","최대주주 변경 기대감에 급등",""
"2017-05-02",47770.0,"코데즈컴바인","투자주의환기종목 해제 소식에 급등",10.74
"2017-05-02",23350.0,"한국종합기술","최대주주 지분매각 검토 기대감 지속에 이틀째 급등",10.36
"2017-05-02",87260.0,"모바일어플라이언스","삼성전자 자율주행차 국토부 임시운행 허가 소식에 자율주행차 관련주 상승 속 급등",9.62
"2017-05-04",77970.0,"STX엔진","매각 주간사 선정 소식에 급등",26.17
"2017-05-04",64090.0,"에프앤리퍼블릭","경영권 변경 및 자금조달 기대감에 급등",21.49
"2017-05-04",60260.0,"뉴보텍","문재인 관련주로 시장에서 부각되며 급등",21.37
"2017-05-04",95660.0,"네오위즈","신작게임 성장 기대감에 급등",16.46
"2017-05-04",69730.0,"DSR제강","문재인 관련주로 시장에서 부각되며 급등",12.95
"2017-05-04",1470.0,"삼부토건","매각 흥행 기대감에 급등",10.11
"2017-05-04",42420.0,"네오위즈홀딩스","자회사 네오위즈의 신작게임 성장 기대감에 급등",9.24
"2017-05-04",155660.0,"DSR","문재인 관련주로 시장에서 부각되며 급등",9.1
"2017-05-08","","","대성산업의 흡수합병 결정에 상한가",""
"2017-05-08",45520.0,"크린앤사이언스","미세먼지 영향에 황사/미세먼지 관련주 강세 속 상한가",29.95
"2017-05-08",128820.0,"대성산업","대성합동지주 흡수합병 결정에 상한가",29.9
"2017-05-08",94190.0,"이엘케이","유상증자 권리락 효과로 급등",18.97
"2017-05-08",155660.0,"DSR","문재인 관련주로 시장에서 부각되며 이틀째 급등",18.68
