"날짜","종목코드","종목명","급등 사유","등락"
"2017-10-27",174900.0,"앱클론","암 치료 항체 日 특허 취득 모멘텀 지속에 급등",24.87
"2017-10-27",900120.0,"씨케이에이치","한-중 정상회담 가능성 제기에 중국 소비 관련주 상승 속 급등",20.1
"2017-10-27",64550.0,"바이오니아","프로바이오틱스 다국적기업과 라이선스 최종 계약 진행 모멘텀 지속에 이틀째 급등",18.81
"2017-10-27",39310.0,"세중","한-중 정상회담 가능성 제기에 중국 소비 관련주 상승 속 급등",17.77
"2017-10-27",84990.0,"헬릭스미스","슈퍼개미 투자 소식 부각에 급등",16.04
"2017-10-27",24940.0,"PN풍년","한-중 정상회담 가능성 제기에 중국 소비 관련주 상승 속 급등",14.91
"2017-10-27",890.0,"보해양조","한-중 정상회담 가능성 속 중국 진출 부각에 급등",11.64
"2017-10-27",23450.0,"동남합성","자사주 소각 결정에 급등",11.32
"2017-10-27",168330.0,"내츄럴엔도텍","백수오 궁 신세계 홈쇼핑 진출 소식에 급등",10.81
"2017-10-27",900070.0,"글로벌에스엠","한-중 정상회담 가능성 제기에 중국 소비 관련주 상승 속 급등",9.75
"2017-10-27","","","한-중 정상회담 가능성 제기에 중국 소비 관련주 상승 속 급등",""
"2017-10-30",32350.0,"롯데관광개발","한-중 관계 개선 기대감 지속에 이틀째 상한가",29.67
"2017-10-30",174900.0,"앱클론","암 치료 항체 日 특허 취득 모멘텀 지속에 상한가",29.98
"2017-10-30",16100.0,"리더스코스메틱","한-중 관계 개선 기대감 지속에 화장품주 상승 속 급등",22.45
"2017-10-30",60260.0,"뉴보텍","中 마스크팩 및 생활용품 등 진출 기대감에 급등",22.33
"2017-10-30",217480.0,"에스디생명공학","한-중 관계 개선 기대감 지속에 화장품주 상승 속 급등",15.04
"2017-10-30","","","한-중 관계 개선 기대감 지속에 카지노주 상승 속 급등",""
"2017-10-30","","","800억원 규모의 공사수주 계약 체결에 급등",""
"2017-10-30",226320.0,"잇츠한불","한-중 관계 개선 기대감 지속에 화장품주 상승 속 급등",12.29
"2017-10-30","","","한-중 관계 개선 기대감 지속에 일부 밥솥주 상승 속 급등",""
"2017-10-30",196300.0,"애니젠","한-중 관계 개선 기대감 지속에 화장품주 상승 속 급등",10.3
"2017-10-30",78520.0,"에이블씨엔씨","한-중 관계 개선 기대감 지속에 화장품주 상승 속 급등",10.22
"2017-10-30",4990.0,"롯데지주","기업 분할합병후 변경상장 첫날 급등",10.0
"2017-10-30",123330.0,"제닉","한-중 관계 개선 기대감 지속에 화장품주 상승 속 급등",9.5
"2017-10-30",49080.0,"기가레인","세계 최초 리버스 방식 ICP 식각장비 양산 소식에 급등",9.43
"2017-10-30",69110.0,"코스온","한-중 관계 개선 기대감 지속에 화장품주 상승 속 급등",9.35
"2017-10-30",8770.0,"호텔신라","3분기 실적 호조 및 한-중 관계 개선 기대감 지속에 급등",9.27
"2017-10-31",180400.0,"캔서롭","최대주주 변경 수반 주식양수도 계약 체결 등에 상한가",29.89
"2017-10-31",64520.0,"바른전자","초슬림 mSATA SSD 단독 개발 양산 소식에 상한가",29.74
"2017-10-31",29480.0,"바른테크놀로지","바른전자의 초슬림 mSATA SSD 단독 개발 양산 소식에 상한가",29.72
"2017-10-31",900040.0,"차이나그레이트","한-중 정상회담 개최 소식에 국내상장 중국기업 강세 속 급등",23.26
"2017-10-31",14190.0,"원익큐브","삼성전자의 OLED 투자 수혜 기대감에 급등",22.97
"2017-10-31",64550.0,"바이오니아","프로바이오틱스 다국적기업과 라이선스 최종 계약 진행 모멘텀 지속에 급등",20.49
"2017-10-31",203690.0,"프로스테믹스","성체 줄기세포와 분화된 세포의 혼합 배양액 관련 특허 취득에 급등",17.4
"2017-10-31","","","한-중 정상회담 개최 소식에 국내상장 중국기업 강세 속 급등",""
"2017-10-31",900120.0,"씨케이에이치","한-중 정상회담 개최 소식에 국내상장 중국기업 강세 속 급등",14.69
"2017-10-31",93240.0,"형지엘리트","한-중 정상회담 개최 소식에 중국 교복 사업 기대감에 급등",12.85
"2017-10-31",900110.0,"이스트아시아홀딩스","한-중 정상회담 개최 소식에 국내상장 중국기업 강세 속 급등",12.66
"2017-10-31",43220.0,"에이치엘비파워","中 분마그룹으로부터 자금 조달 소식에 급등",11.92
"2017-10-31",27390.0,"한화갤러리아타임월드","한-중 정상회담 개최 소식에 일부 면세점 관련주 상승 속 급등",10.77
"2017-10-31",30000.0,"제일기획","3분기 호실적 및 4분기 최대 실적 기대감에 급등",9.47
"2017-11-01",180400.0,"캔서롭","항암신약 특허 벤처기업 인수 기대감에 이틀째 상한가",29.87
"2017-11-01",134780.0,"화진","한-중 관계 회복 수혜 기대감에 급등",20.27
"2017-11-01",93240.0,"형지엘리트","한-중 정상회담 개최 모멘텀 지속에 이틀째 급등",17.47
"2017-11-01",259630.0,"엠플러스","2차전지주 강세 속 급등",15.22
"2017-11-01",41190.0,"우리기술투자","CME, 올해 말 비트코인 선물 도입 소식에 급등",13.56
"2017-11-01",68400.0,"SK렌터카","현대차, 국내 대형 렌터카 업체 인수 추진 모멘텀 지속에 급등",13.13
"2017-11-01",217730.0,"강스템바이오텍","줄기세포 관련주 강세 속 급등",12.98
"2017-11-01",4000.0,"롯데정밀화학","3분기 실적 호조 모멘텀 지속에 급등",11.8
"2017-11-01",10060.0,"OCI","3분기 실적 호조에 급등",10.62
"2017-11-02",3070.0,"코오롱글로벌","티슈진 상장 임박에 코오롱그룹주 강세 속 상한가",29.76
"2017-11-02",2800.0,"신신제약","패치 시장 본격 진입 분석에 급등",18.62
"2017-11-02",144620.0,"코오롱머티리얼","수소차 관련주 강세 및 티슈진 상장 임박에 코오롱그룹주 상승 속 급등",18.45
"2017-11-02",215600.0,"신라젠","펙사벡 기대감 지속에 급등",11.48
"2017-11-02",66970.0,"엘앤에프","전기차 시장 성장의 최대 수혜주 분석에 급등",11.34
"2017-11-02",3670.0,"포스코케미칼","실적 개선세 지속 분석에 급등",10.94
"2017-11-02",81000.0,"일진다이아","테슬라 '모델3' 생산 차질에 따른 반사 이익 기대감에 수소차 관련주 강세 속 급등",9.77
"2017-11-02",23900.0,"풍국주정","테슬라 '모델3' 생산 차질에 따른 반사 이익 기대감에 수소차 관련주 강세 속 급등",9.71
"2017-11-03",241520.0,"DSC인베스트먼트","정부, 혁신창업 생태계 조성 방안 발표에 창투사 관련주 상승 속 상한가",29.9
"2017-11-03",58820.0,"CMG제약","표적항암신약 美 임상 허가 신청 계획 소식에 급등",18.81
"2017-11-03",19570.0,"리더스 기술투자","정부, 혁신창업 생태계 조성 방안 발표에 창투사 관련주 상승 속 급등",13.99
"2017-11-03",246690.0,"TS인베스트먼트","정부, 혁신창업 생태계 조성 방안 발표에 창투사 관련주 상승 속 급등",13.64
"2017-11-03",217730.0,"강스템바이오텍","줄기세포 관련주 상승 속 급등",12.89
"2017-11-03",174900.0,"앱클론","암 치료 항체 日 특허 취득 모멘텀 지속에 급등",12.43
"2017-11-03",171090.0,"선익시스템","삼성디스플레이 등과 총 179.46억원 규모 공급계약 체결에 급등",10.58
"2017-11-03",4980.0,"성신양회","한라시멘트 본입찰 참여 기대감에 급등",9.71
"2017-11-03",166480.0,"코아스템","줄기세포 관련주 상승 속 급등",9.06
"2017-11-06",134060.0,"이퓨쳐","중국 교육사업 진출 소식에 상한가",29.98
"2017-11-06",196300.0,"애니젠","펩타이드 제조기술 부각에 상한가",29.81
"2017-11-06",58820.0,"CMG제약","표적항암신약 美 임상 허가 신청 계획 모멘텀 지속에 이틀째 급등",23.02
"2017-11-06",51780.0,"큐로홀딩스","스마젠, 에이즈백신 상업화 기대감에 급등",22.09
"2017-11-06",64090.0,"에프앤리퍼블릭","中 인바운드 회복 수혜 기대감에 화장품주 강세 속 급등",16.07
"2017-11-06",200230.0,"텔콘RF제약","엠마우스 신약 엔다리 출시 임박 소식에 급등",13.2
"2017-11-06",57030.0,"YBM넷","중국 교육사업 진출 소식에 급등",12.84
"2017-11-06",9450.0,"경동나비엔","3분기 실적 호조에 급등",11.56
"2017-11-06",108320.0,"실리콘웍스","3분기 실적 호조에 급등",10.77
"2017-11-06",39830.0,"오로라","3분기 실적 호조에 급등",10.08
"2017-11-06",192080.0,"더블유게임즈","소셜 카지노 성수기 기대감에 급등",9.85
"2017-11-07",49180.0,"셀루메드","필러용 고분자 복합체 관련 특허 취득에 상한가",29.99
"2017-11-07",950160.0,"코오롱티슈진","인보사 출시를 앞두고 상장 이틀만에 상한가",29.98
"2017-11-07",60590.0,"씨티씨바이오","내년 흑자전환 기대감에 급등",18.33
"2017-11-07",109610.0,"에스와이","베트남 태양광발전 사업 기대감 지속에 급등",10.17
"2017-11-07",194510.0,"파티게임즈","신작 기대감에 급등",9.81
"2017-11-07",196300.0,"애니젠","펩타이드 제조기술 모멘텀 지속에 급등",9.04
"2017-11-08",203690.0,"프로스테믹스","탈모개선 효과 확인 논문 발표 소식에 상한가",29.83
"2017-11-08",127120.0,"디엔에이링크","항암제 관련 美 글로벌 제약사와 계약 체결 소식에 상한가",29.81
"2017-11-08",29960.0,"코엔텍","최대주주 공개매수 소식에 급등",21.93
"2017-11-08",58820.0,"CMG제약","표적항암신약 美 임상 허가 신청 계획 모멘텀 지속에 급등",16.03
"2017-11-08",265560.0,"영화테크","中 전기차 시장 기대감 부각에 급등",15.88
"2017-11-08",182400.0,"엔케이맥스","관계사 엔케이맥스, 日전문병원과 면역항암제 공급 계약 소식에 급등",14.8
"2017-11-08",55490.0,"테이팩스","2차전지주 강세 속 급등",14.29
"2017-11-08",68240.0,"다원시스","자회사, 차세대 암치료기 개발 소식에 급등",13.24
"2017-11-08",1820.0,"삼화콘덴서","차량용 고용량 MLCC 원천소재 개발 소식에 급등",12.47
"2017-11-08",36630.0,"세종텔레콤","통신비 정책 협의회 출범 소식에 일부 제4이동통신주 상승 속 급등",12.22
"2017-11-08",255440.0,"야스","주고객사의 대형 OLED 투자에 따른 수혜 기대감 지속에 급등",10.19
"2017-11-08",121800.0,"비덴트","대표이사 변경 소식에 급등",9.31
"2017-11-09",86890.0,"이수앱지스","면역항암제 바이오시밀러 생산 마무리 단계 진입 소식에 상한가",29.94
"2017-11-09",36180.0,"에이프런티어","신약 개발 기대감에 급등",23.75
"2017-11-09",82850.0,"우리바이오","PCB(FPCB 등) 관련주 상승 속 급등",16.94
"2017-11-09",19170.0,"신풍제약","제약업체 관련주 상승 속 급등",15.57
"2017-11-09",20150.0,"일진머티리얼즈","2차전지주 상승 및 1,584.40억원 규모 신규시설 투자 모멘텀 지속에 급등",14.39
"2017-11-09",123750.0,"알톤스포츠","자전거 관련주 강세 속 급등",12.46
"2017-11-09",49950.0,"미래컴퍼니","3분기 실적 호조 모멘텀 지속에 급등",11.55
"2017-11-09",60280.0,"큐렉소","의료기기주 강세 속 급등",10.17
"2017-11-10",7460.0,"에이프로젠 KIC","최대주주 변경 기대감 및 대규모 자금조달 소식에 상한가",29.83
"2017-11-10",183190.0,"아세아시멘트","한라시멘트 인수 우선협상대상자 선정 소식에 급등",29.67
"2017-11-10",68760.0,"셀트리온제약","셀트리온그룹주 강세 속 급등",27.43
"2017-11-10",192410.0,"감마누","한·중 관계 개선에 따른 중국인 관광객 증가 기대감 부각에 급등",20.14
"2017-11-10",78150.0,"HB테크놀러지","OLED주 강세 속 급등",12.08
"2017-11-10",140670.0,"알에스오토메이션","4차산업 수혜주 상승 속 급등",10.77
"2017-11-10",155650.0,"와이엠씨","OLED주 강세 속 급등",10.34
"2017-11-10",272290.0,"이녹스첨단소재","OLED주 강세 속 급등",10.15
"2017-11-10",52710.0,"아모텍","자동차 전장부품 확대 기대감 지속에 급등",9.94
"2017-11-10",13520.0,"화승알앤에이","현대모비스와 블록딜 모멘텀 지속에 급등",9.6
"2017-11-10",900040.0,"차이나그레이트","국내 상장 중국기업 관련주 상승 속 급등",9.6
"2017-11-10",2210.0,"동성제약","항암 신약 개발 기대감에 급등",9.25
"2017-11-10",79160.0,"CJ CGV","3분기 실적 컨센서스 부합 및 4분기 실적 개선 기대감에 급등",9.2
"2017-11-10",56190.0,"에스에프에이","OLED주 강세 속 급등",9.0
"2017-11-13",7460.0,"에이프로젠 KIC","최대주주 변경 기대감 및 대규모 자금조달 모멘텀 지속에 이틀째 상한가",29.94
"2017-11-13",15020.0,"이스타코","3분기 흑자전환에 상한가",30.0
"2017-11-13",52190.0,"이에스에이","中 중앙정부 기관과 콘텐츠 사업 MOU 체결 소식에 상한가",29.87
"2017-11-13",68760.0,"셀트리온제약","셀트리온그룹주 강세 속 급등",27.92
"2017-11-13",54780.0,"키이스트","사드 해빙 모드 및 광군제 특수 효과에 중국 소비 관련주 상승 속 급등",21.77
"2017-11-13",23910.0,"대한약품","3분기 호실적에 급등",14.94
"2017-11-13",243070.0,"휴온스","3분기 실적 호조에 급등",12.75
"2017-11-13",121800.0,"비덴트","대표이사 변경 모멘텀 지속에 급등",12.23
"2017-11-13",48550.0,"SM C&C","사드 해빙 모드 및 광군제 특수 효과에 중국 소비 관련주 상승 속 급등",10.88
"2017-11-13",91990.0,"셀트리온헬스케어","셀트리온그룹주 강세 속 급등",10.2
"2017-11-13",160550.0,"NEW","사드 해빙 모드 및 광군제 특수 효과에 중국 소비 관련주 상승 속 급등",9.67
"2017-11-13",36420.0,"제이콘텐트리","사드 해빙 모드 및 광군제 특수 효과에 중국 소비 관련주 상승 속 급등",9.64
"2017-11-13",52260.0,"SK바이오랜드","사드 해빙 모드 및 광군제 특수 효과에 중국 소비 관련주 상승 속 급등",9.28
"2017-11-13",39200.0,"오스코텍","치아 치료 관련주 강세 속 급등",9.24
"2017-11-13",145720.0,"덴티움","치아 치료 관련주 강세 속 급등",9.09
"2017-11-14",7460.0,"에이프로젠 KIC","최대주주 변경 기대감 및 대규모 자금조달 모멘텀 지속에 사흘째 상한가",29.76
"2017-11-14",2210.0,"동성제약","항암 신약 개발 기대감 지속 및 광역학치료(PDT) 기술 부각에 상한가",29.94
"2017-11-14",28300.0,"에이치엘비","자회사 LSKB 표적항암제 '아파티닙' 가치 부각에 상한가",29.89
"2017-11-14",156100.0,"엘앤케이바이오","3분기 호실적에 급등",24.58
"2017-11-14",520.0,"삼일제약","지방간치료제 내년 초 임상2상 기대감에 급등",19.64
"2017-11-14",11500.0,"한농화성","3분기 호실적에 급등",18.18
"2017-11-14",67630.0,"에이치엘비생명과학","에이치엘비 자회사 LSKB 표적항암제 '아파티닙' 가치 부각에 상한가",16.92
"2017-11-14",7390.0,"네이처셀","조인트스템 기대감 지속에 급등",12.75
"2017-11-14",214370.0,"케어젠","3분기 호실적 기록 및 내년 4월 신공장 모멘텀에 급등",12.41
"2017-11-14",41830.0,"인바디","본격 외형성장 국면 진입 분석에 급등",12.3
"2017-11-14",39200.0,"오스코텍","다수의 R&D 모멘텀 기대감에 급등",12.13
"2017-11-14",215360.0,"우리산업","3분기 사상 최대 매출 달성에 급등",11.35
"2017-11-14",215600.0,"신라젠","MSCI지수 편입 소식에 급등",10.92
"2017-11-14",84110.0,"휴온스글로벌","3분기 호실적 모멘텀 지속에 급등",10.2
"2017-11-14",93050.0,"LF","실적 개선 분석에 급등",9.73
"2017-11-14",10170.0,"대한광통신","내년 호실적 지속 전망에 급등",9.37
"2017-11-14",92040.0,"아미코젠","자회사 아미코젠바이오팜유한회사 실적 개선 소식에 급등",9.3
"2017-11-15",7460.0,"에이프로젠 KIC","최대주주 변경 기대감 및 대규모 자금조달 모멘텀 지속에 나흘째 상한가",29.94
"2017-11-15",54540.0,"삼영엠텍","경북 포항시 북구 지진 발생 소식에 재난/안전(지진 등) 관련주 상승 속 상한가",29.95
"2017-11-15",101670.0,"코리아에스이","경북 포항시 북구 지진 발생 소식에 재난/안전(지진 등) 관련주 상승 속 상한가",29.91
"2017-11-15",180400.0,"캔서롭","명지병원과 시너지 본격화 기대감에 상한가",29.86
"2017-11-15",140520.0,"대창스틸","경북 포항시 북구 지진 발생 소식에 재난/안전(지진 등) 관련주 상승 속 급등",26.49
"2017-11-15",8930.0,"한미사이언스","제약업체 강세 속 급등",21.41
"2017-11-15",68760.0,"셀트리온제약","셀트리온 그룹주 급등",16.83
"2017-11-15",119500.0,"포메탈","경북 포항시 북구 지진 발생 소식에 관련주로 부각되며 급등",14.71
"2017-11-15",33540.0,"파라텍","경북 포항시 북구 지진 발생 소식에 재난/안전(지진 등) 관련주 상승 속 급등",14.2
"2017-11-15","","","3분기 실적 호조에 급등",""
"2017-11-15",91990.0,"셀트리온헬스케어","셀트리온 그룹주 급등",12.43
"2017-11-15",35900.0,"JYP Ent.","최대 실적 지속 분석에 급등",11.85
"2017-11-15",8290.0,"원풍물산","美 투자사 남용방지형 마약성 진통제 개발 소식에 급등",11.78
"2017-11-15",16610.0,"DB금융투자","증시 강세에 증권주 상승 속 급등",11.08
"2017-11-15",83790.0,"크리스탈","3분기 흑자전환에 급등",10.81
"2017-11-15",28100.0,"동아지질","경북 포항시 북구 지진 발생 소식에 재난/안전(지진 등) 관련주 상승 속 급등",10.67
"2017-11-16",7460.0,"에이프로젠 KIC","최대주주 변경 기대감 및 대규모 자금조달 모멘텀 지속에 닷새째 상한가",29.99
"2017-11-16",11320.0,"유니크","현대차 내년 신형 수소차 공개 소식에 수소차 관련주 상승 속 상한가",29.95
"2017-11-16",49180.0,"셀루메드","줄기세포 치료제 BMP4 복합체 생산 확대 소식에 상한가",29.84
"2017-11-16",1820.0,"삼화콘덴서","美 GM 전기차 플랫폼 출시 및 확대 계획 등으로 전기차 관련주 상승 속 급등",29.78
"2017-11-16",23900.0,"풍국주정","현대차 내년 신형 수소차 공개 소식에 수소차 관련주 상승 속 급등",25.55
"2017-11-16",78130.0,"국일제지","현대차 내년 신형 수소차 공개 소식에 수소차 관련주 상승 속 급등",23.64
"2017-11-16",251370.0,"와이엠티","3분기 실적 호조 모멘텀 지속에 급등",21.35
"2017-11-16",43090.0,"큐브앤컴퍼니","관계사 큐브바이오 소변암 진단키트 상용화 기대감 지속에 급등",18.57
"2017-11-16",91120.0,"이엠텍","KT&G 궐련형 전자담배 릴 사전예약 완판 소식에 급등",17.92
"2017-11-16",91580.0,"상신이디피","美 GM 전기차 플랫폼 출시 및 확대 계획 등으로 2차전지/전기차 관련주 상승 속 급등",17.47
"2017-11-16",200230.0,"텔콘RF제약","비보존 지분 추가 취득 모멘텀 지속에 급등",15.89
"2017-11-16",134780.0,"화진","무상증자 권리락 효과 및 현대차 내년 신형 수소차 공개 소식에 수소차 관련주 상승 속 급등",15.42
"2017-11-16",36000.0,"예림당","3분기 최대 실적 달성 및 내년 실적 호조 지속 전망에 급등",14.14
"2017-11-16",9470.0,"삼화전기","콘덴서 섹터 강세 속 급등",13.71
"2017-11-16",196450.0,"디오스텍","3분기 영업이익 흑자전환 모멘텀 지속에 급등",13.35
"2017-11-16",52190.0,"이에스에이","3분기 실적 호조에 급등",13.33
"2017-11-16",80470.0,"성창오토텍","美 GM 전기차 플랫폼 출시 및 확대 계획 등으로 전기차 관련주 상승 속 급등",12.07
"2017-11-16",68400.0,"SK렌터카","B2B 렌탈시장 높은 성장세 지속 분석에 급등",11.5
"2017-11-16",144620.0,"코오롱머티리얼","현대차 내년 신형 수소차 공개 소식에 수소차 관련주 상승 속 급등",11.44
"2017-11-16",3670.0,"포스코케미칼","美 GM 전기차 플랫폼 출시 및 확대 계획 등으로 2차전지 관련주 상승 속 급등",11.36
"2017-11-16",37370.0,"EG","현대차 내년 신형 수소차 공개 소식에 수소차 관련주 상승 속 급등",11.06
"2017-11-16",82270.0,"젬백스","GV1001 줄기세포 추적·세포 보호 효과 확인 소식에 급등",10.88
"2017-11-16",41190.0,"우리기술투자","창투사 관련주 강세 속 급등",10.54
"2017-11-16",86520.0,"에코프로","美 GM 전기차 플랫폼 출시 및 확대 계획 등으로 2차전지 관련주 상승 속 급등",10.26
"2017-11-16",5110.0,"한창","경북 포항시 북구 지진 발생 모멘텀 지속에 일부 재난/안전(지진 등) 관련주 상승 속 급등",10.06
"2017-11-16",48870.0,"시너지이노베이션","3분기 실적 호조 모멘텀 지속에 급등",10.04
"2017-11-17",7630.0,"폴루스바이오팜","최대주주 등 대상 100억원 규모 3자배정 유상증자 결정에 상한가",30.0
"2017-11-17",7390.0,"네이처셀","조인트스템 기대감 지속에 급등",24.02
"2017-11-17",84650.0,"랩지노믹스","유전자 암치료 진단검사 공급계약 소식에 급등",21.99
"2017-11-17",200230.0,"텔콘RF제약","비보존 지분 추가 취득 모멘텀 지속에 급등",19.24
"2017-11-17",5390.0,"신성통상","평창 롱패딩 인기 지속에 급등",17.89
"2017-11-17",9320.0,"대우부품","현대차 내년 신형 수소차 공개 모멘텀 지속에 일부 수소차 관련주 상승 속 급등",17.52
"2017-11-17",158310.0,"스타모빌리티","PCB(FPCB 등) 관련주 강세 속 급등",15.75
"2017-11-17",67630.0,"에이치엘비생명과학","에이치엘비 자회사 LSKB 표적항암제 '아파티닙' 기대감 지속에 급등",13.41
"2017-11-17",37370.0,"EG","현대차 내년 신형 수소차 공개 모멘텀 지속에 일부 수소차 관련주 상승 속 급등",12.45
"2017-11-17",43200.0,"파루","삼성-볼보 전기트럭 개발 논의 소식에 급등",12.15
"2017-11-17",156100.0,"엘앤케이바이오","3분기 호실적 모멘텀 지속에 급등",11.93
"2017-11-17",20560.0,"아시아나항공","국제 유가 하락 및 원화 강세에 항공주 상승 속 급등",11.26
"2017-11-17",82270.0,"젬백스","GV1001 줄기세포 추적·세포 보호 효과 확인 모멘텀 지속에 급등",9.82
"2017-11-17",83790.0,"크리스탈","3분기 흑자전환 모멘텀 지속에 급등",9.71
"2017-11-17",175140.0,"인포마크","日 라인과 350.23억원 규모 스마트 스피커 공급계약 체결 모멘텀 지속에 급등",9.27
"2017-11-20",215600.0,"신라젠","펙사벡 기대감 지속에 상한가",30.0
"2017-11-20",7460.0,"에이프로젠 KIC","최대주주 변경 기대감 및 대규모 자금조달 모멘텀 지속에 거래재개 첫날 상한가",29.55
"2017-11-20",65060.0,"지엔코","전기차 사업 기대감에 급등",16.94
"2017-11-20","","","세계 최초 천연물 항암 주사제 개발사 투자 부각에 급등",""
"2017-11-20",42520.0,"한스바이오메드","당해 사업연도 호실적에 급등",16.3
"2017-11-20",7630.0,"폴루스바이오팜","최대주주 등 대상 100억원 규모 3자배정 유상증자 모멘텀 지속에 이틀째 급등",15.38
"2017-11-20",19570.0,"리더스 기술투자","창투사 관련주 상승 속 급등",13.68
"2017-11-20",67630.0,"에이치엘비생명과학","라이프리버, 세계 최초 인공간 희귀약품 시판 허가 기대감에 급등",12.8
"2017-11-20",205470.0,"휴마시스","브라질 보건부 위생감시국 승인 모멘텀 지속에 급등",12.73
"2017-11-20",7390.0,"네이처셀","정부의 치매국가책임제 지원방안 마련 기대감에 치매 관련주 상승 속 급등",12.65
"2017-11-20",1360.0,"삼성제약","GV1001 신장암 치료제 기대감에 급등",12.27
"2017-11-20",27390.0,"한화갤러리아타임월드","유커 한국관광 재개 기대감에 면세점 관련주 상승 속 급등",11.85
"2017-11-20",36180.0,"에이프런티어","삼성바이오에피스, 세계 최초 항암 바이오시밀러 유럽 판매 소식에 급등",11.02
"2017-11-20",91090.0,"세원셀론텍","세포치료제 개발 및 생산시스템 부각에 급등",10.89
"2017-11-20",65650.0,"메디프론","정부의 치매국가책임제 지원방안 마련 기대감에 치매 관련주 상승 속 급등",10.38
"2017-11-20",38290.0,"마크로젠","고성장 및 외형 확대 전망에 급등",10.23
"2017-11-21",144510.0,"녹십자랩셀","면역항암제 가치 부각에 상한가",29.98
"2017-11-21",1360.0,"삼성제약","GV1001 신장암 치료제 기대감 지속에 상한가",29.87
"2017-11-21",95190.0,"이엠코리아","자회사, 물에서 고효율 수소생산 기술 이전 부각에 상한가",29.87
"2017-11-21",11320.0,"유니크","수소차 관련주 강세 속 급등",22.84
"2017-11-21",31390.0,"녹십자셀","녹십자그룹주 강세 속 급등",21.55
"2017-11-21",2760.0,"보락","텍솔 항암제 원료 공급 및 의약품 원료 공장 건설 추진 사실 부각에 급등",21.4
"2017-11-21",4000.0,"롯데정밀화학","실적 개선 기대감에 급등",20.41
"2017-11-21",78600.0,"대주전자재료","2차전지용 설비투자 검토 소식에 급등",16.74
"2017-11-21",950160.0,"코오롱티슈진","인보사 기대감 지속에 급등",14.72
"2017-11-21",49550.0,"잉크테크","대규모 구조조정에 따른 내년 흑자전환 기대감 지속에 급등",14.19
"2017-11-21",7460.0,"에이프로젠 KIC","최대주주 변경 기대감 및 대규모 자금조달 모멘텀 지속에 급등",14.04
