"날짜","종목코드","종목명","급등 사유","등락"
"2017-06-20",38870.0,"에코바이오","신재생에너지(바이오가스) 사업 부각에 상한가",29.69
"2017-06-20","","","자진 상장 폐지를 앞두고 이틀째 급등",""
"2017-06-20",204990.0,"코썬바이오","실적 개선 기대감 지속에 이틀째 급등",17.83
"2017-06-20",99220.0,"SDN","탈원전, 신재생 에너지 확대 정책 기대감 지속에 태양광에너지 관련주 상승 속 급등",9.39
"2017-06-21",222420.0,"쎄노텍","獨 전기차 판매 급증 소식 속에 2차전지 관련주 상승 속 급등",18.28
"2017-06-21",192410.0,"감마누","최대주주 변경 수반 주식양수도 계약 체결 모멘텀 지속에 급등",13.89
"2017-06-21",1820.0,"삼화콘덴서","수익성 회복 기대감 지속에 급등",12.22
"2017-06-21",33240.0,"자화전자","갤럭시노트8 조기 출시 수혜 기대감에 일부 관련주 상승 속 급등",11.94
"2017-06-21",3520.0,"영진약품","COPD신약 임상 결과를 앞두고 급등",10.0
"2017-06-22",18680.0,"서울제약","中 업체와 대규모 발기부전치료제 구강붕해필름 공급계약 체결에 상한가",29.83
"2017-06-22",36630.0,"세종텔레콤","제4이동통신사 설립요건 변경 소식에 관련주 강세 속 상한가",29.4
"2017-06-22",60570.0,"드림어스컴퍼니","SK하이닉스, 도시바 인수 시너지 기대감 부각에 급등",27.78
"2017-06-22",31820.0,"콤텍시스템","제4이동통신사 설립요건 변경 소식에 관련주 강세 속 급등",24.24
"2017-06-22",49120.0,"파인디앤씨","자회사 흡수합병 소식에 급등",16.08
"2017-06-22",5420.0,"코스모화학","전기차 성장 수혜 기대감에 급등",10.24
"2017-06-22",30350.0,"드래곤플라이","사옥 매각 등 경영 혁신안 발표 소식에 급등",9.26
"2017-06-23",220260.0,"켐트로스","스팩 합병 상장예비심사 통과에 상한가",30.0
"2017-06-23",64090.0,"에프앤리퍼블릭","文 대통령의 사드 보복조치 해제 요청 언급에 화장품주 상승 속 급등",12.53
"2017-06-23",36570.0,"엔씨소프트","주가하락 과도 분석 및 양대 모바일 마켓 매출 1위 소식에 급등",11.78
"2017-06-26",220260.0,"켐트로스","스팩 합병 상장예비심사 통과 모멘텀 지속에 이틀째 상한가",29.9
"2017-06-26",219130.0,"타이거일렉","반도체 호황에 따른 매출 성장 기대감에 급등",29.95
"2017-06-26",16740.0,"두올","日에어백 제조사 다카타 파산신청 소식에 급등",24.66
"2017-06-26",73640.0,"삼원테크","유상증자 등 투자유치 추진설에 급등",23.88
"2017-06-26",201490.0,"미투온","풀하우스카지노 中 버전 흥행 소식에 급등",13.46
"2017-06-26",207940.0,"삼성바이오로직스","자회사 '임랄디' 유럽 판매 허가 임박 소식에 급등",13.45
"2017-06-26",20150.0,"일진머티리얼즈","글로벌 전기차 시장 확대 기대감 등으로 2차전지주 강세 속 급등",12.02
"2017-06-26",183300.0,"코미코","하반기 대형 수주 지속 전망에 반도체장비주 강세 속 급등",10.2
"2017-06-26",78590.0,"두올산업","관계사 두올이 日에어백 제조사 다카타 파산신청 소식에 급등한 가운데, 동반 급등",10.0
"2017-06-26",9150.0,"삼성전기","업황 호조에 따른 실적 개선 전망에 급등",9.45
"2017-06-26",46890.0,"서울반도체","LED 업계 치킨게임 마무리 국면 돌입에 LED 관련주 상승 속 급등",9.07
"2017-06-27",246690.0,"TS인베스트먼트","창투사 및 4차산업 수혜주 강세 속 상한가",29.97
"2017-06-27",96350.0,"대창솔루션","한국가스공사, 셰일가스 280만톤 도입 소식에 수혜주로 부각되며 상한가",29.91
"2017-06-27",241520.0,"DSC인베스트먼트","창투사 및 4차산업 수혜주 강세 속 급등",21.6
"2017-06-27",220260.0,"켐트로스","스팩 합병 상장예비심사 통과 모멘텀 지속에 사흘째 급등",16.87
"2017-06-27",77970.0,"STX엔진","매각 본격화 기대감 지속에 급등",12.07
"2017-06-27",11560.0,"세보엠이씨","SK하이닉스 투자 수혜 기대감에 급등",11.98
"2017-06-27",5420.0,"코스모화학","이산화티타늄 가격 강세 전망에 급등",11.64
"2017-06-27",3960.0,"사조대림","사조그룹주 강세 속 급등",10.12
"2017-06-27",36000.0,"예림당","호실적 기대감에 급등",9.83
"2017-06-28",192410.0,"감마누","최대주주 예정 SMV 플랫폼 통한 구매액 월 2,000억원 돌파 소식에 상한가",29.89
"2017-06-28",220260.0,"켐트로스","스팩 합병 상장예비심사 통과 모멘텀 지속에 상한가",29.83
"2017-06-28",1290.0,"상상인증권","유상감자 결정에 상한가",29.61
"2017-06-28",38870.0,"에코바이오","신고리 5,6호기 공사 중단 소식에 신재생에너지주 강세 속 급등",11.61
"2017-06-28",1230.0,"동국제강","철강 주요종목 강세 속 급등",9.74
"2017-06-29",109070.0,"컨버즈","위니테크놀러지 흡수합병 결정에 상한가",30.0
"2017-06-29",220260.0,"켐트로스","스팩 합병 상장예비심사 통과 모멘텀 지속에 상한가",29.9
"2017-06-29",252500.0,"세화피앤씨","일부 스팩주 급등 속 상한가",29.8
"2017-06-29",16600.0,"큐캐피탈","SK증권 인수전 참여 소식에 상한가",29.67
"2017-06-29",219130.0,"타이거일렉","반도체 호황에 따른 매출 성장 기대감 지속에 급등",15.87
"2017-06-29",226350.0,"아이엠텍","KGP와 경영권 분쟁 소식에 급등",15.3
"2017-06-29",64820.0,"케이프","자회사 케이프투자증권의 SK증권 인수전 참여 소식에 급등",15.16
"2017-06-29",83650.0,"비에이치아이","정부 에너지 정책 변화 수혜 기대감 지속에 급등",10.81
"2017-06-29",3530.0,"한화투자증권","코스피지수 사상 최고치 경신에 증권주 상승 속 급등",9.56
"2017-06-29",89600.0,"나스미디어","2분기 실적 성장 전망에 급등",9.49
"2017-06-30","","","일부 스팩주 급등 속 상한가",""
"2017-06-30",263770.0,"유에스티","일부 스팩주 급등 속 상한가",29.81
"2017-06-30",109070.0,"컨버즈","위니테크놀러지 흡수합병 모멘텀 지속에 이틀째 급등",19.75
"2017-06-30",204990.0,"코썬바이오","실적 개선 기대감 및 에이풀 완전 자회사 편입 모멘텀 지속에 이틀째 급등",15.57
"2017-06-30",4870.0,"티웨이홀딩스","티웨이항공 유럽·북미 노선 운항 및 상장 추진 소식에 급등",12.25
"2017-06-30",950110.0,"SBI핀테크솔루션즈","자회사 SBI레밋이 태국 시암상업은행과 송금서비스 개시 소식에 급등",11.37
"2017-06-30","","","일부 스팩주 급등",""
"2017-07-03",204620.0,"글로벌텍스프리","글로벌텍스프리㈜ 흡수 합병 기대감 지속에 상한가",29.78
"2017-07-03",7630.0,"폴루스바이오팜","美 태양광발전 업체 지분 처분 결정에 급등",14.36
"2017-07-03",246690.0,"TS인베스트먼트","벤처캐피탈 육성 정책 기대감 지속에 급등",9.75
"2017-07-03",17510.0,"세명전기","남북관계 진전 기대감에 전력설비주 상승 속 급등",9.65
"2017-07-03",3030.0,"세아제강지주","철강주 강세 속 급등",9.57
"2017-07-04",204620.0,"글로벌텍스프리","글로벌텍스프리㈜ 흡수 합병 기대감 지속에 이틀째 상한가",29.85
"2017-07-04",12170.0,"키위미디어그룹","中 국영기업과 3,000억원 규모 공급계약 체결에 상한가",30.0
"2017-07-04",218410.0,"RFHIC","일부 스팩주 급등",17.65
"2017-07-04",65450.0,"빅텍","北 미사일 발사 및 중대 발표 예고 소식에 방위산업/전쟁 및 테러 관련주 상승 속 급등",15.97
"2017-07-04",220100.0,"퓨쳐켐","치매조기진단용 방사성 의약품 개발 소식 부각에 급등",11.72
"2017-07-04",215600.0,"신라젠","美 국립암연구소와 대장암 신약 공동 개발 소식에 급등",10.45
"2017-07-04",230980.0,"솔트웍스","北 미사일 발사 및 중대 발표 예고 소식에 방위산업/전쟁 및 테러 관련주 상승 속 급등",10.03
"2017-07-04",36630.0,"세종텔레콤","제4이동통신 등록제 기대감에 급등",9.82
"2017-07-05",123040.0,"엠에스오토텍","테슬라 보급형 전기차 양산 수혜 기대감에 상한가",29.85
"2017-07-05",80470.0,"성창오토텍","테슬라 보급형 전기차 양산 수혜 기대감에 전기차 관련주 상승 속 급등",16.67
"2017-07-05",8700.0,"아남전자","삼성 빅스비 탑재 스마트스피커 개발 소식에 급등",12.68
"2017-07-05",166090.0,"하나머티리얼즈","삼성전자 반도체/디스플레이 추가 투자 소식에 반도체 관련주 상승 속 급등",12.17
"2017-07-05",178920.0,"SKC코오롱PI","삼성전자 반도체/디스플레이 추가 투자 소식에 PCB(FPCB 등) 관련주 상승 속 급등",11.54
"2017-07-05",8060.0,"대덕전자","삼성전자 반도체/디스플레이 추가 투자 소식에 PCB(FPCB 등) 관련주 상승 속 급등",10.09
"2017-07-05",83650.0,"비에이치아이","LNG 가격 하락에 따른 복합화력발전 경제성 부각에 급등",9.61
"2017-07-05",2990.0,"금호산업","실적 성장 및 수주 모멘텀 기대감에 급등",9.56
"2017-07-05",101160.0,"월덱스","삼성전자 반도체/디스플레이 추가 투자 소식에 반도체 관련주 상승 속 급등",9.46
"2017-07-06","","","최대주주 변경에 상한가",""
"2017-07-06",205100.0,"엑셈","실적 성장 지속 기대감에 급등",16.6
"2017-07-06",94820.0,"일진파워","정부의 탈원전 정책에 따른 사업 확대 기대감에 급등",8.87
"2017-07-07",205470.0,"휴마시스","합병상장 예비심사 승인에 거래재개 첫날 상한가",30.0
"2017-07-07",85310.0,"엔케이","선박평형수 의무화 추진 기대감에 선박평형수 처리장치 관련주 상승 속 급등",11.48
"2017-07-07",20150.0,"일진머티리얼즈","일부 2차전지 관련주 강세 속 급등",10.56
"2017-07-07",217500.0,"러셀","일부 스팩주 급등",9.16
"2017-07-10",4270.0,"남성","ADAS 의무화를 앞두고 자율주행차 관련주로 부각되며 상한가",30.0
"2017-07-10",205470.0,"휴마시스","합병상장 예비심사 승인 모멘텀 지속에 이틀째 상한가",29.88
"2017-07-10",161570.0,"THE MIDONG","ADAS 의무화를 앞두고 자율주행차 관련주 상승 속 급등",19.47
"2017-07-10",1380.0,"SG충방","자동차부품 업체 ㈜신동 흡수합병 결정에 급등",15.93
"2017-07-10",90460.0,"비에이치","2분기 호실적 전망에 급등",11.44
"2017-07-10",87260.0,"모바일어플라이언스","ADAS 의무화를 앞두고 자율주행차 관련주 상승 속 급등",11.11
"2017-07-10",49520.0,"유아이엘","무상증자 및 자사주 소각, 현금배당 결정에 급등",9.78
"2017-07-10",49120.0,"파인디앤씨","국토부 드론사업 시연회 개최 소식에 관련주로 부각되며 급등",9.4
"2017-07-11","","","일부 스팩주 강세 속 상한가",""
"2017-07-11",5420.0,"코스모화학","2차전지 수요 급증 기대감에 2차전지주 상승 속 급등",18.72
"2017-07-11",54630.0,"에이디칩스","MCU 초경량 반도체 독자개발 소식에 급등",12.44
"2017-07-11",5070.0,"코스모신소재","2차전지 수요 급증 기대감에 2차전지주 상승 속 급등",12.1
"2017-07-11",77500.0,"유니퀘스트","ADAS 의무화 시행 기대감 지속에 관련주로 부각되며 급등",10.54
"2017-07-11",134780.0,"화진","최대주주 변경 수반 주식양수도 계약 체결 모멘텀 지속에 급등",10.27
"2017-07-11",83500.0,"에프엔에스테크","하반기 본격적인 OLED 투자 확대에 따른 실적 성장 전망에 급등",9.56
"2017-07-12",187220.0,"디티앤씨","영국 원전 수출에 따른 수혜 기대감 부각에 급등",12.78
"2017-07-12",43710.0,"서울리거","홍콩 진출 기대감에 급등",12.43
"2017-07-12",137940.0,"넥스트아이","자체개발 화장품 76종 中 출시 기대감 지속에 급등",11.95
"2017-07-12",3670.0,"포스코케미칼","흑연전극 가격 급등 수혜 기대감에 급등",9.69
"2017-07-12",66970.0,"엘앤에프","일부 2차전지 관련주 상승 속 급등",9.59
"2017-07-12",3560.0,"IHQ","매각 기대감 부각에 급등",9.28
"2017-07-12",11790.0,"SKC","주력사업 실적 상승 기대감 부각에 급등",9.17
"2017-07-13",32790.0,"엠젠플러스","인간 인슐린 분비 복제돼지 생산 성공 소식에 상한가",30.0
"2017-07-13",151910.0,"나노스","상장유지 결정에 거래재개 첫날 상한가",29.86
"2017-07-13",81000.0,"일진다이아","일진복합소재, 현대차에 수소탱크 독점 납품 소식 재부각에 급등",25.77
"2017-07-13",49180.0,"셀루메드","자회사 엠젠플러스의 인간 인슐린 분비 복제돼지 생산 성공 소식에 급등",20.31
"2017-07-13",219130.0,"타이거일렉","반도체 재료/부품주 강세 속 급등",12.53
"2017-07-13",100120.0,"뷰웍스","과도한 주가조정 분석에 급등",11.06
"2017-07-14",151910.0,"나노스","상장유지 결정에 거래재개 후 이틀째 상한가",29.95
"2017-07-14",6390.0,"한일현대시멘트","매각 기대감에 상한가",30.0
"2017-07-14",32790.0,"엠젠플러스","인간 인슐린 분비 복제돼지 생산 성공 모멘텀 지속에 이틀째 급등",16.52
"2017-07-14",246690.0,"TS인베스트먼트","2~3개사에 대한 추가적인 인수합병(M&A) 검토 소식에 급등",11.87
"2017-07-14","","","정리매매 첫날 급등",""
"2017-07-17",151910.0,"나노스","상장유지 결정에 거래재개 후 사흘째 상한가",29.8
"2017-07-17",2620.0,"제일파마홀딩스","변경상장 첫날 상한가",29.89
"2017-07-17",5070.0,"코스모신소재","2분기 영업이익 급증 및 전기차 성장 수혜 기대감에 2차전지주 상승 속 급등",22.92
"2017-07-17",4920.0,"씨아이테크","최저임금 인상에 키오스크 사업 부각에 급등",18.12
"2017-07-17",6390.0,"한일현대시멘트","매각 기대감 지속에 이틀째 급등",16.48
"2017-07-17",20150.0,"일진머티리얼즈","전기차 성장 수혜 기대감에 2차전지주 상승 속 급등",15.0
"2017-07-17",86520.0,"에코프로","전기차 성장 수혜 기대감에 2차전지주 상승 속 급등",14.91
"2017-07-17",66970.0,"엘앤에프","전기차 성장 수혜 기대감에 2차전지주 상승 속 급등",12.01
"2017-07-17",84870.0,"TBH글로벌","실적 개선 전망에 급등",11.76
"2017-07-17",13870.0,"지엠비코리아","신규 개발 수소차 부품 개발 진행 모멘텀 지속에 급등",10.04
"2017-07-17",62860.0,"티엘아이","윈팩 지분 매각 추진설에 급등",9.95
"2017-07-17",5290.0,"동진쎄미켐","반도체 재료/부품 관련주 상승 속 급등",9.77
"2017-07-18",151910.0,"나노스","상장유지 결정에 거래재개 후 나흘째 상한가",29.6
"2017-07-18",60570.0,"드림어스컴퍼니","SK텔레콤-에스엠 시너지 기대감에 상한가",29.89
"2017-07-18",251630.0,"브이원텍","2차전지 사업 기대감에 상한가",29.82
"2017-07-18",77970.0,"STX엔진","매각 본입찰 순항 기대에 급등",15.66
"2017-07-18",5070.0,"코스모신소재","2분기 영업이익 급증 및 전기차 성장 수혜 기대감 지속에 이틀째 급등",12.9
"2017-07-18",63570.0,"한국전자금융","최저임금 인상 모멘텀 지속에 키오스크(KIOSK) 관련주 상승 속 급등",12.2
"2017-07-18",224060.0,"코디엠","반도체 장비주 강세 속 급등",11.82
"2017-07-18",18000.0,"유니슨","실적 개선 기대감에 급등",11.48
"2017-07-18",54950.0,"제이브이엠","올해 실적 개선 기대감에 급등",11.01
"2017-07-18",94850.0,"참좋은여행","자전거 사업부문 분할 결정에 급등",10.8
"2017-07-18",90460.0,"비에이치","2분기 호실적 전망에 급등",9.03
"2017-07-19",87730.0,"에스모 머티리얼즈","최대주주 지분매각 검토 소식에 상한가",29.95
"2017-07-19",88390.0,"이녹스","올해 실적 기대감 등으로 상한가",29.76
"2017-07-19",82660.0,"코스나인","세계 최초 글라스 패터닝 화장품 케이스 개발 소식에 급등",18.07
"2017-07-19",60570.0,"드림어스컴퍼니","SK텔레콤-에스엠 시너지 기대감 지속 및 알리바바-정부, 국내 기업 中 진출 지원 소식에 급등",15.63
"2017-07-19",10170.0,"대한광통신","광학 의료용 광섬유 프로브 판매 허가 소식에 급등",14.94
"2017-07-19",68790.0,"DMS","LG디스플레이 대규모 투자 수혜 기대감에 급등",9.88
"2017-07-19",134780.0,"화진","최대주주 변경 수반 주식양수도 계약 체결 모멘텀 지속에 급등",9.47
"2017-07-20",71970.0,"STX중공업","공개경쟁입찰 매각 개시 소식에 급등",25.54
"2017-07-20",223310.0,"이에스브이","4차산업 수혜주 강세 속 급등",17.12
"2017-07-20",112610.0,"씨에스윈드","신재생에너지 확대 정책 기대감에 풍력에너지 관련주 상승 속 급등",10.88
"2017-07-20",60250.0,"NHN한국사이버결제","전자결제(전자화폐)주 강세 속 급등",10.63
"2017-07-20",45890.0,"GV","캐나다 합작법인 지분매각 추진에 급등",10.16
"2017-07-20",77970.0,"STX엔진","매각 본입찰 순항 기대감 지속에 급등",10.15
"2017-07-20",131290.0,"티에스이","반도체 장비주 강세 속 급등",9.69
"2017-07-20",224060.0,"코디엠","반도체 장비주 강세 속 급등",9.4
"2017-07-20",9310.0,"참엔지니어링","반도체 장비주 강세 속 급등",9.29
"2017-07-20",94480.0,"갤럭시아컴즈","2분기 실적 호조 모멘텀 지속에 급등",9.22
"2017-07-21",52790.0,"액토즈소프트","자회사의 e스포츠 사업 본격화 기대감에 상한가",29.75
"2017-07-21",182690.0,"테라셈","中 BYD의 美 시장 진출 본격화에 따른 수혜 기대감 부각에 급등",18.3
"2017-07-21",217820.0,"엔에스","中 전기차 및 2차전지 업체로부터 신규수주 모멘텀 지속에 급등",17.82
"2017-07-21",88390.0,"이녹스","올해 실적 기대감 지속에 급등",12.11
"2017-07-21",43220.0,"에이치엘비파워","합병추진 업체 ESS 기술 부각에 급등",10.24
"2017-07-21",73490.0,"이노와이어리스","5G산업 기대감에 시장에서 관련주로 부각되며 급등",9.29
"2017-07-24",5070.0,"코스모신소재","주차장 내 전기차 충전 콘센트 의무화 소식에 2차전지주 상승 속 급등",18.45
"2017-07-24",238490.0,"힘스","하반기 디스플레이 시장 호황 기대감에 급등",14.55
"2017-07-24",86520.0,"에코프로","주차장 내 전기차 충전 콘센트 의무화 소식에 2차전지주 상승 속 급등",13.2
"2017-07-24",196490.0,"디에이테크놀로지","주차장 내 전기차 충전 콘센트 의무화 소식에 2차전지주 상승 속 급등",11.48
"2017-07-24",20150.0,"일진머티리얼즈","유상증자 권리락 효과 및 주차장 내 전기차 충전 콘센트 의무화 소식에 2차전지주 상승 속 급등",10.96
"2017-07-25",16600.0,"큐캐피탈","SK증권 매각 우선협상대상자 선정을 앞두고 급등",22.35
"2017-07-25",18000.0,"유니슨","신재생에너지 확대 정책 기대감 지속에 급등",11.89
"2017-07-25",4910.0,"조광페인트","도료업계 전방산업 개선 전망에 페인트주 상승 속 급등",9.26
"2017-07-25",182360.0,"큐브엔터","스타라인엔터테인먼트 합병효과 및 씨엘씨, 장현승 컴백 기대감에 급등",9.21
"2017-07-26",168330.0,"내츄럴엔도텍","백수오 제품 홈쇼핑 판매 재개 소식에 상한가",30.0
"2017-07-26",43200.0,"파루","전기차 적용 가능 필림히터 삼성전자 공급 소식에 상한가",29.99
"2017-07-26",64820.0,"케이프","SK증권 매각 우선협상대상자 케이프컨소시엄 선정에 상한가",29.98
"2017-07-26",220260.0,"켐트로스","SK증권 매각 우선협상대상자 케이프컨소시엄 선정에 급등",19.72
"2017-07-26",25880.0,"케이씨피드","자회사 케이씨프레쉬 흡수합병 결정에 급등",16.59
"2017-07-26",3090.0,"대웅","대웅제약 2분기 어닝서프라이즈에 급등",12.82
"2017-07-26",181340.0,"이즈미디어","신규 상장 첫날 급등",11.43
"2017-07-26",79550.0,"LIG넥스원","2분기 깜짝 실적에 급등",9.41
"2017-07-27",43200.0,"파루","전기차 적용 가능 필림히터 삼성전자 공급 모멘텀 지속에 이틀째 상한가",29.9
"2017-07-27",136510.0,"쎄미시스코","이마트서 전기차 판매 소식에 상한가",29.83
"2017-07-27","","","인도네시아 SOC 사업 진출 소식에 급등",""
"2017-07-28",203650.0,"드림시큐리티","카카오뱅크 돌풍에 상한가",29.85
"2017-07-28",52400.0,"코나아이","카카오뱅크 돌풍에 급등",15.63
"2017-07-28",91990.0,"셀트리온헬스케어","신규 상장 첫날 급등",15.23
"2017-07-31",109960.0,"에이프로젠 H&G","에이프로젠 바이오시밀러 日 품목허가 심의 통과 소식에 상한가",29.95
"2017-07-31",4410.0,"서울식품","주식분할에 따른 유동성 확대 기대감 부각에 상한가",29.93
"2017-07-31",43200.0,"파루","전기차 적용 가능 필림히터 삼성전자 공급 모멘텀 지속에 급등",16.49
"2017-07-31",3060.0,"에이프로젠제약","에이프로젠 바이오시밀러 日 품목허가 심의 통과 소식에 급등",15.77
"2017-07-31",168330.0,"내츄럴엔도텍","백수오 제품 홈쇼핑 판매 재개 모멘텀 지속에 급등",14.45
"2017-07-31",220260.0,"켐트로스","합병예정 법인 실적개선 부각에 급등",11.63
"2017-07-31",203650.0,"드림시큐리티","카카오뱅크 흥행 지속에 일부 인터넷 은행 강세 속 급등",11.2
"2017-08-01",220260.0,"켐트로스","합병예정 법인 성장성 부각에 상한가",29.93
"2017-08-01",213090.0,"미래테크놀로지","카카오뱅크 보안 인증시스템 공급 소식에 상한가",29.84
"2017-08-01",4410.0,"서울식품","주식분할에 따른 유동성 확대 기대감 지속에 이틀째 급등",21.07
"2017-08-01",30790.0,"동양네트웍스","카카오뱅크 IT시스템 개발 참여 소식에 급등",19.85
"2017-08-01",64820.0,"케이프","SK증권 매각 우선협상대상자 케이프컨소시엄 선정 모멘텀 지속에 급등",16.18
"2017-08-01",54670.0,"대한뉴팜","법인세 완납 소식에 급등",15.14
"2017-08-01",540.0,"흥국화재","상반기 이익 증가 소식에 손해보험주 상승 속 급등",15.04
"2017-08-01",267270.0,"현대건설기계","2분기 실적 선방에 급등",12.55
"2017-08-01",4430.0,"송원산업","하반기 성장 본격화 전망에 급등",12.25
"2017-08-01",214270.0,"퓨쳐스트림네트웍스","㈜와이즈버즈 주식 양수 결정에 급등",11.21
"2017-08-01",41460.0,"한국전자인증","블록체인 R&D사업자 선정 소식에 급등",10.92
"2017-08-01",35600.0,"KG이니시스","업계 최초 전자결제 월 거래 2조원 돌파 소식에 급등",10.81
"2017-08-01",150.0,"두산","실적 발표를 앞두고 급등",9.75
"2017-08-02",131100.0,"알이피","상장폐지 사유 해소 및 대규모 자금조달 결정에 거래재개 첫날 상한가",30.0
"2017-08-02",215480.0,"토박스코리아","무상증자 권리락 효과에 급등",27.6
"2017-08-02",97780.0,"에스맥","애플 아이폰 터치스크린패널 공급 소식에 급등",15.15
"2017-08-02",220260.0,"켐트로스","합병예정 법인 성장성 기대감 지속에 사흘째 급등",14.15
"2017-08-02",3520.0,"영진약품","신약후보물질 美 임상 2상 완료 소식에 급등",11.06
"2017-08-02",101160.0,"월덱스","반도체 재료/부품주 강세 속 급등",11.02
"2017-08-02",11070.0,"LG이노텍","애플 호실적에 급등",10.37
"2017-08-02",90460.0,"비에이치","애플 호실적에 급등",10.2
"2017-08-02",15540.0,"쎌마테라퓨틱스","자회사 미덴탈 흡수합병 결정에 급등",9.5
"2017-08-02",4770.0,"써니전자","안철수 당권도전 기대감에 시장에서 관련주로 부각되며 급등",9.16
"2017-08-03",43200.0,"파루","필름히터에 관한 시장 의혹 부인에 상한가",29.91
"2017-08-03",168330.0,"내츄럴엔도텍","백수오 제품 홈쇼핑 판매 재개 모멘텀 지속에 급등",19.4
"2017-08-03",72520.0,"제넨바이오","폐기물 처리사업 기대감 부각에 급등",14.95
"2017-08-03",52190.0,"이에스에이","제작 참여 뮤지컬 '나폴레옹' 흥행 모멘텀 지속에 급등",13.47
"2017-08-04",203650.0,"드림시큐리티","카카오뱅크 흥행 지속에 상한가",29.87
"2017-08-04",4920.0,"씨아이테크","병원스마트케어 업체 지분 취득 소식에 급등",13.44
"2017-08-04",52400.0,"코나아이","카카오뱅크 체크카드 IC 운영체제 공급 모멘텀 지속에 급등",12.81
"2017-08-04",52190.0,"이에스에이","제작 참여 뮤지컬 '나폴레옹' 흥행 모멘텀 지속에 급등",12.23
"2017-08-04",49950.0,"미래컴퍼니","수술로봇 제조 식약처 허가 모멘텀 지속에 급등",11.79
"2017-08-04",5430.0,"한국공항","2분기 실적 호조에 급등",11.63
"2017-08-04",6910.0,"보성파워텍","전기차 수혜주로 부각되며 급등",10.71
"2017-08-04",222800.0,"심텍","2분기 호실적에 급등",9.61
"2017-08-07",263800.0,"데이타솔루션","신규상장 사흘만에 상한가",30.0
"2017-08-07",192410.0,"감마누","주당 3주 무상증자 결정에 급등",26.85
"2017-08-07",43910.0,"자연과환경","정부, 도시재생 뉴딜사업 선정 계획 확정 소식에 급등",22.63
"2017-08-07",80440.0,"에스제이케이","中 4,000억원 규모 의료사업 SPC 지분 65% 확보 소식에 급등",17.55
"2017-08-07",1840.0,"이화공영","정부, 도시재생 뉴딜사업 선정 계획 확정 소식에 급등",15.5
"2017-08-07",7390.0,"네이처셀","조인트스템 美 임상결과 기대감 지속에 급등",14.7
"2017-08-08",30960.0,"양지사","품절주로 부각되며 상한가",29.98
