"날짜","종목코드","종목명","급등 사유","등락"
"2016-03-28",65420.0,"에스아이리소스","드라마 '사임당' 회당 3억 규모 中 수출 소식에 급등",19.21
"2016-03-28",49480.0,"오픈베이스","삼성전자의 인공지능(AI) 개발사 인수합병(M&A) 기대감이 지속되며 급등",16.53
"2016-03-28",36260.0,"이매진아시아","고소영 영입설에 급등",14.81
"2016-03-28",149940.0,"모다","삼성전자의 사물인터넷 사업 강화 모멘텀이 지속되며 급등",13.09
"2016-03-28",115480.0,"씨유메디칼","무상증자 결정에 급등",12.4
"2016-03-29",96640.0,"멜파스","中 기업 대규모 투자자금 유치에 상한가",30.0
"2016-03-29",47770.0,"코데즈컴바인","투자경고종목 해제 소식에 상한가",29.86
"2016-03-29",68760.0,"셀트리온제약","서정진 회장 동생 대표이사 선임에 급등",11.48
"2016-03-29",58730.0,"다스코","사우디 메트로 지상교량 설치공사 LOI 체결에 급등",10.87
"2016-03-29",100220.0,"비상교육","교과서 입찰에 따른 실적 개선 기대감에 급등",10.84
"2016-03-30",36630.0,"세종텔레콤","유상증자 성공에 급등",14.83
"2016-03-30",27040.0,"서울전자통신","삼성페이가 유니온페이와 중국 전역에서 결제서비스를 시작한다는 소식에 관련주로 부각되며 급등",13.04
"2016-03-30",58420.0,"제이웨이","경영권 분쟁 가능성 소식에 급등",12.35
"2016-03-30",10060.0,"OCI","폴리실리콘 가격 반등에 따른 실적 개선 기대감이 지속되며 급등",10.53
"2016-03-30",44480.0,"바이오제네틱스","中 업체와의 대규모 콘돔 공급계약 협의 진행 모멘텀이 지속되며 급등",9.96
"2016-03-30",63170.0,"서울옥션","올해 경매 실적 최고치 경신 전망에 급등",9.44
"2016-03-30",6090.0,"사조오양","저평가 분석에 급등",9.02
"2016-03-31","","","지난해 영업이익 흑자전환 모멘텀이 재부각되며 상한가",""
"2016-03-31",27710.0,"팜스토리","적자사업부 매각에 따른 실적 개선 기대감에 급등",18.61
"2016-03-31",64760.0,"티씨케이","신규 시설투자 결정에 급등",16.78
"2016-03-31",187790.0,"나노","글로벌 대기환경 규제 강화에 따른 수혜 전망에 급등",16.52
"2016-03-31",25950.0,"동신건설","관리종목 해제 소식에 급등",12.56
"2016-04-01",43710.0,"서울리거","서울리거파트너스의 경영참여 목적 지분 보유 소식에 급등",15.68
"2016-04-01",101670.0,"코리아에스이","자사주 취득 결정 모멘텀이 지속되며 급등",15.19
"2016-04-01",81000.0,"일진다이아","올해 호실적 지속 기대감에 급등",13.0
"2016-04-01",3520.0,"영진약품","만성폐쇄성 폐질환(COPD) 천연물 신약 기대감이 지속되며 급등",12.8
"2016-04-01",50320.0,"에이앤티앤","최대주주 변경에 따른 이란 국가재난망 사업 기대감이 지속되며 급등",11.16
"2016-04-04",43710.0,"서울리거","서울리거파트너스의 경영참여 목적 지분 보유 모멘텀이 지속되며 상한가",30.0
"2016-04-04","","","지난해 영업이익 흑자전환에 상한가",""
"2016-04-04",31860.0,"엔에스엔","제3자배정 유상증자 추진설에 상한가",29.96
"2016-04-04",86520.0,"에코프로","테슬라 '모델3' 흥행 소식에 전기차/2차전기 관련주 상승 속 급등",18.48
"2016-04-04",1820.0,"삼화콘덴서","테슬라 '모델3' 흥행 소식에 전기차/2차전기 관련주 상승 속 급등",17.99
"2016-04-04",80470.0,"성창오토텍","테슬라 '모델3' 흥행 소식에 전기차/2차전기 관련주 상승 속 급등",17.76
"2016-04-04",131390.0,"피앤이솔루션","테슬라 '모델3' 흥행 소식에 전기차/2차전기 관련주 상승 속 급등",12.94
"2016-04-04",90350.0,"노루페인트","페인트 관련주 상승 속 급등",12.82
"2016-04-04",2390.0,"한독","올해 실적 개선 전망에 급등",11.46
"2016-04-04",39840.0,"디오","디오나비 성장 기대감이 지속되며 급등",11.38
"2016-04-04",67630.0,"에이치엘비생명과학","LSK BioPartners, Inc.(USA) 지분 추가 취득 소식에 급등",10.07
"2016-04-05",31860.0,"엔에스엔","100억원 규모 유상증자 결정에 급등",25.6
"2016-04-05",93230.0,"이아이디","재무구조 개선 기대감에 급등",17.1
"2016-04-05",109740.0,"디에스케이","투자경고종목 해제로 급등",11.4
"2016-04-05",131100.0,"알이피","일부 전기차/2차전기 관련주 상승 속 급등",10.71
"2016-04-05",149940.0,"모다","삼성전자의 사물인터넷 사업 강화 모멘텀이 지속되며 급등",10.41
"2016-04-05",50320.0,"에이앤티앤","해외 위성통신 사업 참여 검토 소식에 급등",9.9
"2016-04-05",91580.0,"상신이디피","일부 전기차/2차전기 관련주 상승 속 급등",9.54
"2016-04-05",68760.0,"셀트리온제약","셀트리온 ‘램시마’ 4월 초 美 FDA 판매 승인 기대감이 지속되며 급등",9.23
"2016-04-06",93240.0,"형지엘리트","中 교복시장 진출 소식에 상한가",30.0
"2016-04-06",168330.0,"내츄럴엔도텍","유럽제약사와 백수오추출물 공급계약 체결 소식에 상한가",30.0
"2016-04-06",36630.0,"세종텔레콤","제4이동통신 사업 재도전 기대감이 지속되며 상한가",29.9
"2016-04-06","","","'김수현 폰' 中 예약판매 돌풍 소식에 급등",""
"2016-04-06",158310.0,"스타모빌리티","유상증자 및 전환사채 발행 검토 소식에 급등",21.84
"2016-04-06",58110.0,"멕아이씨에스","스위스 기업과 고유량 호흡치료기 공급 업무협약 체결 모멘텀이 지속되며 급등",15.34
"2016-04-06",11080.0,"형지I&C","형지엘리트의 中 교복시장 진출 소식에 동반 급등",13.67
"2016-04-06",23790.0,"동일철강","철강주 상승 속 급등",10.88
"2016-04-06",114090.0,"GKL","2분기부터 실적 개선 전망에 급등",10.02
"2016-04-07",68760.0,"셀트리온제약","셀트리온 ""램시마"" 美 FDA 판매 승인 모멘텀 지속으로 상한가",30.0
"2016-04-07",131400.0,"액트","최대주주 지분매각 및 제3자배정 유상증자 검토 소식에 상한가",29.89
"2016-04-07",109070.0,"컨버즈","최대주주 변경 및 대표이사 횡령 혐의 각하 소식에 상한가",29.82
"2016-04-07",72520.0,"제넨바이오","감자 및 주식분할 결정에 급등",18.24
"2016-04-07",3520.0,"영진약품","KT&G생명과학 흡수합병 결정에 급등",17.02
"2016-04-07",47310.0,"파워로직스","갤럭시노트6 홍채인식 솔루션 탑재 소식에 급등",16.98
"2016-04-07",93230.0,"이아이디","재무구조 개선 기대감 지속에 급등",13.0
"2016-04-07",93240.0,"형지엘리트","중국 교복사업 진출 MOU 체결 모멘텀 지속에 급등",11.14
"2016-04-07",193250.0,"와이제이엠게임즈","YG엔터 등 투자 소식에 급등",10.56
"2016-04-08",12610.0,"경인양행","정부의 설탕과의 전쟁 선포에 따른 수혜 부각에 급등",20.73
"2016-04-08",83640.0,"인콘","정부 보안 시스템 강화 소식에 보안주(물리) 상승 속 급등",12.65
"2016-04-08",180400.0,"캔서롭","지카바이러스 및 메르스 진단키트 식약처 허가 획득 소식에 급등",12.26
"2016-04-08",60240.0,"룽투코리아","""검과마법"" 게임 출시 기대감 지속에 급등",11.11
"2016-04-08",53800.0,"안랩","보안주(정보) 상승 및 안철수 관련주로 부각되며 급등",11.03
"2016-04-08",54920.0,"한컴위드","정부 보안 시스템 강화 소식에 보안주(정보) 상승 속 급등",10.28
"2016-04-08",2760.0,"보락","정부의 설탕과의 전쟁 선포에 따른 수혜 부각에 급등",10.04
"2016-04-08",192250.0,"케이사인","정부 보안 시스템 강화 소식에 보안주(정보) 상승 속 급등",9.34
"2016-04-11",79370.0,"제우스","진단의학 핵심소재 기술 개발 소식에 상한가",29.96
"2016-04-11",93240.0,"형지엘리트","中 교복사업 진출을 위한 MOU 체결 모멘텀 지속에 상한가",29.91
"2016-04-11",11080.0,"형지I&C","형지엘리트의 中 교복사업 진출을 위한 MOU 체결 모멘텀 지속에 상한가",29.9
"2016-04-11",225530.0,"보광산업","사상 최대 실적 달성 전망에 상한가",29.4
"2016-04-11",32790.0,"엠젠플러스","日 정부의 이종이식 임상 허용 기대감에 급등",22.38
"2016-04-11",50320.0,"에이앤티앤","해외 위성통신 사업 참여 검토 모멘텀 지속에 급등",16.67
"2016-04-11",35610.0,"솔본","글로벌 IT 기업들의 인공지능(AI) M&A 움직임에 자회사 가치가 부각되며 급등",11.79
"2016-04-11",150.0,"두산","올해 실적 턴어라운드 전망에 급등",10.58
"2016-04-11",23410.0,"유진기업","1분기 실적개선 기대감에 급등",9.6
"2016-04-12",94840.0,"슈프리마에이치큐","슈프리마 공개매수 소식에 상한가",29.76
"2016-04-12",93240.0,"형지엘리트","中 교복사업 진출을 위한 MOU 체결 모멘텀 지속에 급등",20.27
"2016-04-12",50320.0,"에이앤티앤","해외 위성통신 사업 참여 검토 모멘텀 지속에 급등",18.57
"2016-04-12",236200.0,"슈프리마","슈프리마에이치큐의 동사 공개매수 소식에 급등",15.96
"2016-04-12",89230.0,"THE E&M","거래재개 첫날 상장폐지 위기 해소로 급등",11.83
"2016-04-12",11080.0,"형지I&C","형지엘리트의 中 교복사업 진출을 위한 MOU 체결 모멘텀 지속에 급등",11.7
"2016-04-12",82740.0,"HSD엔진","그룹리스크 완화 및 턴어라운드 전망에 급등",11.23
"2016-04-12",49080.0,"기가레인","신규사업 기대감에 급등",11.13
"2016-04-12",38340.0,"UCI","세정에듀 흡수합병 결정에 급등",10.19
"2016-04-14",6910.0,"보성파워텍","반기문 총장에 대한 대망론이 힘을 얻을 것이라는 전망에 상한가",29.96
"2016-04-14",65650.0,"메디프론","치매치료제 관련 유럽 특허 취득에 상한가",29.86
"2016-04-14",96350.0,"대창솔루션","총선에서 안철수 대성공 소식에 급등",18.24
"2016-04-14",66790.0,"씨씨에스","반기문 총장에 대한 대망론이 힘을 얻을 것이라는 전망에 급등",17.1
"2016-04-14",32080.0,"아즈텍WB","김두관 후보 당선 소식 및 형지 中 교복시장 진출 수혜 기대감에 급등",16.93
"2016-04-14",118000.0,"우리들휴브레인","총선 야당 승리소식에 문재인 관련주 급등",15.57
"2016-04-14",49630.0,"재영솔루텍","반기문 총장에 대한 대망론이 힘을 얻을 것이라는 전망에 급등",14.29
"2016-04-14",42670.0,"두산인프라코어","中 굴삭기 판매 회복 기대감 지속에 급등",13.2
"2016-04-14",9830.0,"한화솔루션","1분기 실적호조 전망에 급등",12.85
"2016-04-14",34020.0,"두산중공업","中 원전 서비스 진출 기대감에 급등",10.17
"2016-04-15",11080.0,"형지I&C","형지엘리트의 中 교복사업 진출을 위한 MOU 체결 모멘텀이 지속되며 상한가",30.0
"2016-04-15",93240.0,"형지엘리트","中 교복사업 진출을 위한 MOU 체결 모멘텀이 지속되며 상한가",30.0
"2016-04-15",127710.0,"아시아경제","자회사 팍스넷 상장 기대감에 상한가",30.0
"2016-04-15",47770.0,"코데즈컴바인","단기과열완화장치 해제 속 정상거래 첫날 상한가",29.95
"2016-04-15",32080.0,"아즈텍WB","김두관 후보 당선 소식 및 형지 中 교복시장 진출 수혜 기대감이 지속되며 급등",26.01
"2016-04-15",40350.0,"큐로컴","57억원 규모 CB 발행 결정에 급등",21.58
"2016-04-15",65650.0,"메디프론","치매치료제 관련 유럽 특허 취득 모멘텀이 지속되며 급등",17.54
"2016-04-15",197210.0,"리드","삼성디스플레이 OLED패널 애플 납품 소식에 OLED관련주 상승 속 급등",15.38
"2016-04-15",171010.0,"램테크놀러지","삼성디스플레이 OLED패널 애플 납품 소식에 OLED관련주 상승 속 급등",11.11
"2016-04-15",20180.0,"대신정보통신","유승민 새누리당 복당 가능성 부각에 급등",10.53
"2016-04-18",118000.0,"우리들휴브레인","문재인 차기 대선주자 지지율 1위 소식에 상한가",29.95
"2016-04-18",65060.0,"지엔코","최대주주 대상 유상증자 결정에 상한가",29.82
"2016-04-18",60260.0,"뉴보텍","문재인 차기 대선주자 지지율 1위 소식에 상한가",29.76
"2016-04-18",40350.0,"큐로컴","지엔코 유상증자 참여 소식에 급등",26.72
"2016-04-18",4720.0,"우리들제약","문재인 차기 대선주자 지지율 1위 소식에 급등",25.34
"2016-04-18",15260.0,"에이엔피","문재인 차기 대선주자 지지율 1위 소식에 급등",18.47
"2016-04-18",127710.0,"아시아경제","자회사 팍스넷 상장 기대감이 지속되며 급등",12.61
"2016-04-18",18700.0,"바른손","문재인 차기 대선주자 지지율 1위 소식에 급등",11.96
"2016-04-18",54540.0,"삼영엠텍","일본 지진에 따른 수혜 기대감에 급등",11.57
"2016-04-19",60260.0,"뉴보텍","문재인 차기 대선주자 지지율 1위 모멘텀 지속에 이틀째 상한가",29.82
"2016-04-19",139050.0,"데일리블록체인","김종인, 당 대표 가능성 부각에 상한가",29.87
"2016-04-19",11160.0,"두산건설","1분기 어닝서프라이즈 달성에 상한가",29.84
"2016-04-19",96690.0,"제이스테판","제주 카지노 추진 소식에 상한가",29.59
"2016-04-19",123840.0,"한일진공","하이비젼시스템 주식 취득 결정에 급등",18.53
"2016-04-19",53610.0,"프로텍","삼성전자의 아이폰용 낸드플래시 공급 소식에 급등",16.31
"2016-04-19",93240.0,"형지엘리트","中 교복사업 진출을 위한 MOU 체결 모멘텀이 지속되며 급등",14.87
"2016-04-19",45510.0,"정원엔시스","김종인, 당 대표 가능성 부각에 급등",10.32
"2016-04-19",1250.0,"GS글로벌","유상증자 권리락 효과로 급등",10.24
"2016-04-20",18700.0,"바른손","문재인 차기 대선주자 지지율 1위 모멘텀 지속에 상한가",30.0
"2016-04-20",27580.0,"상보","中 정부와 그래핀배리어 공동개발 소식에 상한가",29.98
"2016-04-20",48830.0,"엔피케이","안철수, 광주·전남지역 대선 지지율 1위 소식에 상한가",29.95
"2016-04-20",96350.0,"대창솔루션","안철수, 광주·전남지역 대선 지지율 1위 소식에 상한가",29.92
"2016-04-20",60310.0,"3S","일본지진으로 삼성전자 웨이퍼캐리어 단독 공급 소식에 상한가",29.82
"2016-04-20",34940.0,"조아제약","中 아동의약품 시장 본격 진출 소식에 급등",27.47
"2016-04-20",60260.0,"뉴보텍","문재인 차기 대선주자 지지율 1위 모멘텀 지속에 급등",16.61
"2016-04-20",93640.0,"다믈멀티미디어","안철수, 광주·전남지역 대선 지지율 1위 소식에 급등",15.8
"2016-04-20",88290.0,"이원컴포텍","개인투자자 대량 매수 소식에 급등",11.82
"2016-04-21",20180.0,"대신정보통신","유승민 여권 대권후보 지지율 1위 소식에 상한가",30.0
"2016-04-21",7530.0,"영신금속","유승민 여권 대권후보 지지율 1위 소식에 상한가",29.92
"2016-04-21",2290.0,"삼일기업공사","유승민 여권 대권후보 지지율 1위 소식에 상한가",29.9
"2016-04-21",4100.0,"태양금속","자회사 유상증자 결정에 상한가",29.81
"2016-04-21",6910.0,"보성파워텍","반기문, 문재인과 가상대결서 초박빙이라는 소식에 급등",16.91
"2016-04-21",48830.0,"엔피케이","안철수, 광주·전남지역 대선 지지율 1위 모멘텀이 지속되며 급등",12.55
"2016-04-21",78590.0,"두올산업","유승민 여권 대권후보 지지율 1위 소식에 급등",12.43
"2016-04-21",35460.0,"기산텔레콤","와이파이 성능 2배 향상 장비 개발 소식에 급등",12.17
"2016-04-21",49630.0,"재영솔루텍","반기문, 문재인과 가상대결서 초박빙이라는 소식에 급등",12.1
"2016-04-21",86520.0,"에코프로","1분기 실적 호조에 급등",12.0
"2016-04-22","","","전략적 투자유치 및 신사업 진출 검토 소식에 사흘째 상한가",""
"2016-04-22",66590.0,"우수AMS","테슬라 '모델3' 부품 공급 소식에 상한가",29.96
"2016-04-22",86250.0,"이노와이즈","테슬라 '모델3' 부품 공급 소식에 상한가",29.87
"2016-04-22",54090.0,"삼진엘앤디","테슬라 '모델3' 부품 공급 소식에 급등",23.14
"2016-04-22",15540.0,"쎌마테라퓨틱스","유상증자 성공 소식에 급등",12.98
"2016-04-22",32790.0,"엠젠플러스","정부의 바이오 육성 방침에 급등",11.73
"2016-04-22",33560.0,"블루콤","안정성 및 성장성 부각에 급등",9.92
"2016-04-25",41190.0,"우리기술투자","창투사 관련주 상승 속 상한가",30.0
"2016-04-25",60310.0,"3S","장비 공급계약 체결에 상한가",30.0
"2016-04-25",109820.0,"진매트릭스","차세대 분자진단 원천기술 확보 소식에 상한가",29.93
"2016-04-25",37440.0,"희림","이란 건설사업수주 기대감에 상한가",29.91
"2016-04-25",1260.0,"남광토건","이란 건설사업수주 기대감에 상한가",29.85
"2016-04-25",3520.0,"영진약품","케이티앤지생명과학과 소규모합병 결의 모멘텀 지속에 상한가",29.85
"2016-04-25",214420.0,"토니모리","화장품 관련주 상승 속 급등",16.28
"2016-04-25",71090.0,"하이스틸","이란 수출 기대감에 급등",14.97
"2016-04-25",222040.0,"코스맥스엔비티","1분기 실적 호조에 급등",13.47
"2016-04-25",34940.0,"조아제약","베트남 등 동남아 수출 본격화 소식에 급등",12.1
"2016-04-25","","","전략적 투자유치 및 신사업 진출 검토 모멘텀이 지속되며 급등",""
"2016-04-26",109820.0,"진매트릭스","차세대 분자진단 원천기술 확보 모멘텀이 지속되며 이틀째 상한가",29.79
"2016-04-26",66590.0,"우수AMS","테슬라 '모델3' 인기와 중국 전기차 시장 본격화 기대감 지속에 상한가",29.92
"2016-04-26",48870.0,"시너지이노베이션","거래 재개 첫 날 상한가",29.86
"2016-04-26",50320.0,"에이앤티앤","최대주주가 이란 국가통신망에 솔루션을 공급한다는 소식에 급등",17.04
"2016-04-26",86250.0,"이노와이즈","테슬라 '모델3' 부품 공급 모멘텀이 지속되며 급등",12.23
"2016-04-26",3520.0,"영진약품","케이티앤지생명과학과 소규모합병 결의 모멘텀이 지속되며 급등",10.26
"2016-04-27",48870.0,"시너지이노베이션","거래 재개 후 이틀째 상한가",29.93
"2016-04-27",11080.0,"형지I&C","패션그룹형지, 中 유통사와 MOU 체결 소식에 상한가",29.96
"2016-04-27",137950.0,"제이씨케미칼","물품공급계약 체결 소식에 상한가",29.94
"2016-04-27",63440.0,"SM Life Design","최대주주 지분매각 추진설에 급등",28.3
"2016-04-27",93240.0,"형지엘리트","패션그룹형지, 中 유통사와 MOU 체결 소식에 급등",25.56
"2016-04-27",49480.0,"오픈베이스","SK C&C-알리바바 클라우드사업 추진 기대에 급등",17.86
"2016-04-27",32080.0,"아즈텍WB","패션그룹형지, 中 유통사와 MOU 체결 소식에 급등",15.45
"2016-04-27",49470.0,"SGA","SK C&C-알리바바 클라우드사업 추진 기대에 급등",13.28
"2016-04-28",48870.0,"시너지이노베이션","거래 재개 후 사흘째 상한가",29.99
"2016-04-28",63440.0,"SM Life Design","최대주주 변경을 수반하는 주식양수도 계약 체결 및 유상증자 결정에 상한가",29.98
"2016-04-28",2720.0,"국제약품","지카바이러스 관련주로 부각되며 상한가",29.89
"2016-04-28",6570.0,"대림통상","고은희 회장 보유지분 확대 소식에 상한가",29.86
"2016-04-28",14470.0,"부방","계열회사 부산방직공업(주) 흡수합병 결정에 급등",26.19
"2016-04-28",11080.0,"형지I&C","형지그룹, 中 유통사와 MOU 체결 모멘텀이 지속되며 급등",18.06
"2016-04-28","","","부방의 동사 흡수합병 결정에 급등",""
"2016-04-29",48870.0,"시너지이노베이션","거래재개 후 나흘째 상한가",29.7
"2016-04-29",63440.0,"SM Life Design","최대주주 변경을 수반하는 주식양수도 계약 체결 및 유상증자 모멘텀이 지속되며 이틀째 상한가",29.98
"2016-04-29",200230.0,"텔콘RF제약","美 개량신약 전문 제약사와 전략적 제휴 소식에 상한가",29.89
"2016-04-29",3060.0,"에이프로젠제약","에이프로젠 상장 소식에 급등",21.74
"2016-04-29",34830.0,"한국토지신탁","1분기 실적 호조에 급등",9.01
"2016-05-02",48870.0,"시너지이노베이션","거래재개 후 닷새째 상한가",29.77
"2016-05-02",57540.0,"옴니시스템","이란 수주 기대감에 상한가",29.98
"2016-05-02","","","투자주의종목 해제에 상한가",""
"2016-05-02","","","화이자신과 한중 합작법인 설립 추진 및 화이자신 경영참여 기대감에 급등",""
"2016-05-02",30530.0,"원익홀딩스","회사 분할 후 변경상장 첫날 급등",19.05
"2016-05-02",71090.0,"하이스틸","이란 경제사절단 참여 소식에 급등",11.74
"2016-05-03","","","사우디 왕자 방한 소식에 상한가",""
"2016-05-03",69460.0,"대호에이엘","이란 인프라투자 참여 기대감에 철도주 상승 속 상한가",29.81
"2016-05-03",86900.0,"메디톡스","1분기 실적 호조에 급등",14.53
"2016-05-03",102120.0,"어보브반도체","자사주 처분 결정에 급등",13.5
"2016-05-03",37440.0,"희림","이란 라프타리와 600만달러 규모 MOU 체결 소식에 급등",12.48
"2016-05-03",48870.0,"시너지이노베이션","거래재개 후 엿새째 급등",12.35
"2016-05-03",17480.0,"삼현철강","이란 인프라투자 참여 기대감에 철도주 상승 속 급등",11.69
"2016-05-03",60570.0,"드림어스컴퍼니","SKT와 이란 사물인터넷망 구축 소식에 급등",10.36
"2016-05-03",65500.0,"오리엔트정공","유상증자 권리락 효과로 급등",10.21
"2016-05-03",45390.0,"대아티아이","이란 인프라투자 참여 기대감에 철도주 상승 속 급등",10.03
"2016-05-04",10280.0,"쌍용정보통신","최대주주 지분매각설에 상한가",29.94
"2016-05-04",30350.0,"드래곤플라이","정부의 VR 산업 육성 소식에 상한가",29.87
"2016-05-04",25320.0,"시노펙스","中 상·하수도 정수시장 본격 진출 소식에 급등",21.43
"2016-05-04","","","사우디 왕자 방한 모멘텀이 지속되며 이틀째 급등",""
"2016-05-09",47770.0,"코데즈컴바인","주가조작 리스크 해소에 상한가",29.88
"2016-05-09",7390.0,"네이처셀","""바스코스템"", 美 FDA로부터 희귀의약품 지정 승인 소식에 급등",20.82
"2016-05-09",161570.0,"THE MIDONG","중국내 영화사업 확대 기대감이 지속되며 급등",15.21
"2016-05-09",192820.0,"코스맥스","일부 화장품 관련주 상승 속 1분기 실적 호조에 급등",10.32
"2016-05-10",44380.0,"주연테크","110억원 규모 3자배정 유상증자 결정에 상한가",29.82
"2016-05-10",3520.0,"영진약품","제약주 강세 속 급등",18.65
"2016-05-10",2760.0,"보락","해태제과 상장 기대감 및 옥시 사태에 따른 반사이익 기대감에 급등",17.74
"2016-05-10",119650.0,"KC코트렐","이란 테헤란시와 1억 달러 사업협약 체결 소식에 급등",13.5
"2016-05-10",47770.0,"코데즈컴바인","주가조작 리스크 해소 모멘텀이 지속되며 이틀째 급등",11.95
"2016-05-10",51780.0,"큐로홀딩스","7.74억원 규모 제3자 유상증자 결정에 급등",11.71
"2016-05-10",126870.0,"뉴로스","무상증자 결정에 급등",10.94
"2016-05-10",28300.0,"에이치엘비","위암치료제 '아파티닙' 기대감에 급등",9.44
"2016-05-10",18880.0,"한온시스템","1분기 실적 호조에 급등",9.22
"2016-05-11",5070.0,"코스모신소재","매각 기대감에 상한가",29.9
"2016-05-11",6390.0,"한일현대시멘트","매각 기대감에 상한가",29.84
"2016-05-11",101530.0,"해태제과식품","신규 상장 첫 날 상한가",29.82
"2016-05-11",52420.0,"오성첨단소재","신주 및 구주매각 신문공고 결정에 급등",20.29
"2016-05-11",9450.0,"경동나비엔","1분기 실적 호조에 급등",17.79
"2016-05-11",58450.0,"일야","반기문 총장 방한 소식에 급등",12.5
"2016-05-11",5420.0,"코스모화학","계열사 코스모신소재 지분 매각 기대감에 급등",11.42
"2016-05-11",3160.0,"디아이","싸이와 中 완다그룹의 MOU 체결 소식에 급등",10.42
"2016-05-11",123040.0,"엠에스오토텍","원/달러 환율 급등 수혜 기대감이 지속되며 급등",10.32
"2016-05-12",6390.0,"한일현대시멘트","매각 기대감이 지속되며 이틀째 상한가",29.98
"2016-05-12",101530.0,"해태제과식품","신규 상장 후 이틀째 상한가",29.88
"2016-05-12",12170.0,"키위미디어그룹","제3자배정 유상증자 및 최대주주 변경 추진설에 상한가",29.53
"2016-05-12",3060.0,"에이프로젠제약","에이프로젠, 이달 코스닥 상장 예비심사 신청 소식에 급등",11.31
"2016-05-12",7160.0,"사조산업","사조동아원의 해태제과식품 지분가치 부각에 따른 사조그룹주 상승 속 급등",9.67
"2016-05-12",74610.0,"나노메딕스","1분기 실적 호조에 급등",8.81
"2016-05-13",6390.0,"한일현대시멘트","매각 기대감이 지속되며 사흘째 상한가",29.97
"2016-05-13",101530.0,"해태제과식품","신규 상장 후 사흘째 상한가",29.89
"2016-05-13",23450.0,"동남합성","미원이오디 흡수합병 결정에 상한가",29.92
"2016-05-13",6910.0,"보성파워텍","반기문 총장 방한 모멘텀이 지속되며 급등",24.04
"2016-05-13","","","액면분할 후 거래 재개 첫날 급등",""
"2016-05-13",39340.0,"한국경제TV","1분기 실적 호조에 급등",16.03
"2016-05-13",1540.0,"안국약품","바이오의약품 해외시장 본격 진출 소식에 급등",14.79
